paper_id,title,source,published,authors,categories,hf_papers_url,arxiv_url,local_pdf,principal_argument,methodology,main_findings,limitations_or_gaps,future_opportunities,notes
2603.22281,ThinkJEPA: Empowering Latent World Models with Large Vision-Language Reasoning Model,huggingface_papers;arxiv,2026-03-23T17:59:42Z,Haichao Zhang; Yijiang Li; Shwai He; Tushar Nagarajan; Mingfei Chen; Jianglin Lu; Ang Li; Yun Fu,cs.CV; cs.AI; cs.CL; cs.LG; cs.RO,https://huggingface.co/papers/2603.22281,https://arxiv.org/abs/2603.22281,/root/workspace/jepa/pdfs/2603.22281.pdf,Long-horizon latent world modeling improves when dense JEPA dynamics are guided by semantically richer reasoning signals from a large vision-language model.,"Combines a dense JEPA branch for fine-grained motion with a sparsely sampled VLM thinker branch for semantic guidance, using a hierarchical pyramid module to convert multi-layer VLM representations into features compatible with latent prediction.","On hand-manipulation trajectory prediction, the method beats both a strong VLM-only baseline and a JEPA predictor baseline and produces more robust long-horizon rollouts.","The abstract focuses on hand-manipulation trajectories and specifically motivates the method around VLM sparse sampling, language bottlenecks, and small-data adaptation issues.",Apply VLM-guided JEPA world modeling to broader action-conditioned forecasting tasks and refine how reasoning signals are injected across time scales.,abstract-level synthesis
2603.21340,ARYA: A Physics-Constrained Composable & Deterministic World Model Architecture,arxiv,2026-03-22T17:46:04Z,Seth Dobrin; Lukasz Chmiel,cs.AI; cs.DC,https://huggingface.co/papers/2603.21340,https://arxiv.org/abs/2603.21340,/root/workspace/jepa/pdfs/2603.21340.pdf,"A deterministic, composable world model built from specialized nano models and protected by an immutable safety kernel can satisfy canonical world-model requirements without a monolithic neural foundation model.","Describes the ARYA architecture through five design principles, a hierarchical system of nano models orchestrated by the AARA agent, formal alignment to canonical world-model requirements, and high-level benchmark comparisons against named frontier systems.","The abstract claims linear scaling, sparse activation, selective untraining, sub-20-second training cycles, an uncircumventable safety boundary, and state-of-the-art results on 6 of 9 benchmarks across seven industry nodes.","The abstract is claim-dense and summarizes benchmark outcomes at a high level without detailing protocols, conditions, or the evidence behind each comparison.",Independent validation of the reported benchmark claims and further study of composable safety-constrained world models across domain-specific deployments.,abstract-level synthesis
2603.20048,Structured Latent Dynamics in Wireless CSI via Homomorphic World Models,arxiv,2026-03-20T15:32:47Z,Salmane Naoumi; Mehdi Bennis; Marwa Chafii,eess.SP; cs.LG,https://huggingface.co/papers/2603.20048,https://arxiv.org/abs/2603.20048,/root/workspace/jepa/pdfs/2603.20048.pdf,"Wireless CSI can be modeled as structured latent dynamics, and imposing homomorphic geometric structure makes JEPA world models more predictive and spatially faithful.","Learns action-conditioned latent dynamics from CSI trajectories with a self-supervised JEPA framework and uses Lie-algebra-based homomorphic updates to structure transitions in latent space, then evaluates on DICHASUS.","The method preserves topology and forecasts future embeddings better than strong baselines across unseen environments, while also producing metrically faithful channel charts.","The abstract reports results on DICHASUS and latent-space quality, but does not detail how performance transfers to wider wireless deployments.","Build downstream systems for mobility-aware scheduling, localization, and wireless scene understanding on top of the learned latent space.",abstract-level synthesis
2603.20327,Probing the Latent World: Emergent Discrete Symbols and Physical Structure in Latent Representations,arxiv,2026-03-20T01:30:59Z,Liu hung ming,cs.LG; cs.AI; cs.CV,https://huggingface.co/papers/2603.20327,https://arxiv.org/abs/2603.20327,/root/workspace/jepa/pdfs/2603.20327.pdf,Frozen JEPA video encoders already contain structured physical information that can be exposed as discrete symbols through passive quantization without retraining the encoder.,"Introduces the AI Mother Tongue probe, a lightweight vocabulary-free quantizer applied to frozen V-JEPA 2 latents, and evaluates symbol distributions on Kinetics-mini category-contrast experiments spanning grasp angle, object geometry, and temporal motion structure.","Symbol distributions differ significantly across all three physical dimensions, and the latent space appears compact, with semantic differences expressed as graded distributional shifts rather than clean categorical partitions.","The paper is framed as Stage 1 of a larger roadmap, so it demonstrates passive probing of frozen representations rather than a full action-conditioned symbolic world model.",Continue toward the proposed multi-stage action-conditioned symbolic world model and expand interpretability studies of frozen JEPA latent spaces.,abstract-level synthesis
2603.19100,LuMamba: Latent Unified Mamba for Electrode Topology-Invariant and Efficient EEG Modeling,huggingface_papers;arxiv,2026-03-19T16:26:11Z,Danaé Broustail; Anna Tegon; Thorir Mar Ingolfsson; Yawei Li; Luca Benini,cs.AI,https://huggingface.co/papers/2603.19100,https://arxiv.org/abs/2603.19100,/root/workspace/jepa/pdfs/2603.19100.pdf,EEG foundation modeling can be made more topology-invariant and efficient by combining latent predictive pretraining with linear-complexity temporal modeling.,"Builds LuMamba from LUNA-based channel unification, bidirectional Mamba temporal blocks, and LeJEPA-style self-supervision, pretraining on more than 21,000 hours of TUEG EEG and testing across five downstream tasks with different electrode layouts.","Combining masked reconstruction with LeJEPA yields the strongest representations, enabling strong downstream accuracy, 377 times fewer FLOPS than state-of-the-art models at similar sequence lengths, and much longer sequence scaling.","The abstract notes that LeJEPA alone gives diffuse embeddings and reconstruction alone is less generalizable, implying that the best results rely on a combined objective rather than a single pretext.","Extend the approach to additional biosignals, electrode configurations, and pretraining-objective combinations.",abstract-level synthesis
2604.03266,Emergent Compositional Communication for Latent World Properties,huggingface_papers;arxiv,2026-03-18T20:23:52Z,Tomek Kaszyński,cs.MA; cs.LG,https://huggingface.co/papers/2604.03266,https://arxiv.org/abs/2604.03266,/root/workspace/jepa/pdfs/2604.03266.pdf,"Multi-agent communication pressure can extract discrete and compositional representations of hidden physical properties from frozen video features, and the backbone determines which properties are easiest to communicate.","Uses agents linked by a Gumbel-Softmax bottleneck with iterated learning, runs controls on bandwidth and temporal coverage, performs causal interventions, compares DINOv2 and V-JEPA 2, and validates on Physics 101 real-camera footage.","With four agents, nearly all seeds converge to near-perfect compositionality; multi-agent structure, not simple bandwidth, drives the effect; DINOv2 is stronger on spatially visible ramp physics while V-JEPA 2 is stronger on dynamics-only collision physics; the learned protocol also supports planning and counterfactual reasoning.","The abstract studies a defined set of latent physical properties and frozen backbones, and shows that performance depends strongly on communication structure and perceptual prior.","Probe more physical properties, broaden real-world validation, and use the learned compositional protocol for richer planning and control.",abstract-level synthesis
2603.16281,Laya: A LeJEPA Approach to EEG via Latent Prediction over Reconstruction,arxiv,2026-03-17T09:13:29Z,Saarang Panchavati; Uddhav Panchavati; Corey Arnold; William Speier,cs.LG; q-bio.NC,https://huggingface.co/papers/2603.16281,https://arxiv.org/abs/2603.16281,/root/workspace/jepa/pdfs/2603.16281.pdf,"For EEG representation learning, latent prediction with LeJEPA is a more promising self-supervised objective than raw-signal reconstruction because reconstruction can overemphasize artifacts instead of neural structure.","Introduces Laya as the first EEG foundation model based on LeJEPA and compares it with reconstruction-based baselines across multiple EEG benchmarks, with emphasis on linear probing behavior.","Laya improves linear-probe performance across the evaluated EEG benchmarks, supporting latent predictive objectives as a path to more transferable high-level EEG representations.","The abstract itself notes that EEG foundation-model gains can be modest and sensitive to downstream adaptation and fine-tuning, and it summarizes results without detailing every benchmark condition.",Further test LeJEPA-style EEG pretraining under varied downstream adaptation strategies and across broader clinical and BCI settings.,abstract-level synthesis
2603.15916,"Auto Researching, not hyperparameter tuning: Convergence Analysis of 10,000 Experiments",arxiv,2026-03-16T21:05:39Z,Xiaoyi Li,cs.LG; cs.AI,https://huggingface.co/papers/2603.15916,https://arxiv.org/abs/2603.15916,/root/workspace/jepa/pdfs/2603.15916.pdf,Autonomous LLM experimenters mainly succeed by discovering better architectural regions of the design space rather than by merely tuning hyperparameters.,"Analyzes 10,469 LLM-designed experiments across 108,000 discrete configurations for dashcam collision detection over 27 days, using ANOVA, cross-task validation, convergence analysis, and multi-agent search-dynamics metrics.","Architectural choices explain 94% of performance variance in the main study and 75% in the second dataset, the agents identify a V-JEPA 2 plus Zipformer combination that humans had not proposed, and guided search reaches strong performance faster than random search.","The evidence comes from collision-detection experiments plus one additional validation dataset, and the convergence analysis is explicitly post-bugfix.",Apply the evaluation framework to other tasks and use the observed specialization and entropy dynamics to design stronger autonomous research agents.,abstract-level synthesis
2603.15553,Self-Distillation of Hidden Layers for Self-Supervised Representation Learning,arxiv,2026-03-16T17:13:27Z,Scott C. Lowe; Anthony Fuller; Sageev Oore; Evan Shelhamer; Graham W. Taylor,cs.CV; cs.LG,https://huggingface.co/papers/2603.15553,https://arxiv.org/abs/2603.15553,/root/workspace/jepa/pdfs/2603.15553.pdf,Predicting multiple hidden-layer teacher representations can stabilize predictive self-supervised learning and capture richer abstractions than relying on reconstruction or final-layer targets alone.,"Introduces Bootleg, a hierarchical self-distillation method that predicts latent targets from several teacher hidden layers, and evaluates it on image classification and semantic segmentation benchmarks against predictive and generative SSL baselines.","Bootleg substantially outperforms comparable baselines, including about a 10% gain over I-JEPA on the classification results highlighted in the abstract, while also improving semantic segmentation performance.",The abstract grounds the evidence in image classification and segmentation tasks and does not detail how the method behaves in other modalities or settings.,Transfer hierarchical latent-target prediction to other modalities and other predictive SSL architectures.,abstract-level synthesis
2603.13227,Representation Learning for Spatiotemporal Physical Systems,arxiv,2026-03-13T17:59:51Z,Helen Qu; Rudy Morel; Michael McCabe; Alberto Bietti; François Lanusse; Shirley Ho; Yann LeCun,cs.LG; cs.CV,https://huggingface.co/papers/2603.13227,https://arxiv.org/abs/2603.13227,/root/workspace/jepa/pdfs/2603.13227.pdf,"Downstream scientific tasks are a better test of physically meaningful representations than next-frame emulation, and latent-space self-supervised methods can be more useful than pixel-level prediction objectives.","Compares general-purpose self-supervised methods and physics-oriented modeling approaches on downstream tasks for spatiotemporal physical systems, including governing-parameter estimation.","Not all methods designed for physical modeling outperform generic self-supervised learning. Methods that learn in latent space, including JEPA-style approaches, outperform pixel-level prediction objectives on the evaluated downstream tasks.",The summary emphasizes downstream evaluation tasks such as parameter estimation and does not specify broader task coverage or detailed computational tradeoffs beyond the pitfalls of autoregressive emulators.,Extend evaluation to more scientific inference tasks and further develop latent-space representation learning methods for physics-grounded modeling.,abstract-level synthesis
2603.12772,PVI: Plug-in Visual Injection for Vision-Language-Action Models,arxiv,2026-03-13T08:16:53Z,Zezhou Zhang; Songxin Zhang; Xiao Xiong; Junjie Zhang; Zejian Xie; Jingyi Xi; Zunyao Mao; Zan Mao; Zhixin Mai; Zhuoyang Song; Jiaxing Zhang,cs.CV; cs.LG; cs.RO,https://huggingface.co/papers/2603.12772,https://arxiv.org/abs/2603.12772,/root/workspace/jepa/pdfs/2603.12772.pdf,"A lightweight plug-in module can inject auxiliary visual cues into vision-language-action models without major architectural changes, and temporal video features are especially valuable for action prediction.","Introduces Plug-in Visual Injection (PVI), an encoder-agnostic module with zero-initialized residual pathways attached to a pretrained action expert, then compares temporal video features such as V-JEPA2 against static features such as DINOv2 in simulation and real-robot settings.","PVI delivers consistent gains over the base policy and other injection strategies. Temporal video features from V-JEPA2 outperform strong static image features, with the biggest gains on multi-phase tasks; real-robot cloth-folding results support practical usefulness.","The summary highlights specific simulated tasks and a long-horizon cloth-folding demonstration, but does not establish how broadly the method transfers across robot platforms or task families.",Explore broader long-horizon manipulation settings and additional temporal feature sources within lightweight plug-in architectures.,abstract-level synthesis
2603.11417,Zero-Shot Cross-City Generalization in End-to-End Autonomous Driving: Self-Supervised versus Supervised Representations,arxiv,2026-03-12T01:19:32Z,Fatemeh Naeinian; Ali Hamza; Haoran Zhu; Anna Choromanska,cs.CV; cs.LG,https://huggingface.co/papers/2603.11417,https://arxiv.org/abs/2603.11417,/root/workspace/jepa/pdfs/2603.11417.pdf,"Zero-shot transfer to unseen cities exposes major failure modes in end-to-end driving, and self-supervised visual representations improve robustness relative to supervised backbones.","Integrates self-supervised backbones including I-JEPA, DINOv2, and MAE into planning frameworks, then evaluates strict geographic train-test splits on nuScenes in open-loop and NAVSIM in closed-loop.","Models with traditional supervised backbones show a large cross-city generalization gap, especially when transferring across different driving conventions. Self-supervised pretraining sharply reduces this gap and improves closed-loop PDMS by up to 4 percent.","The reported evidence is tied to the listed backbones, datasets, and evaluation protocols, and the summary does not claim coverage of other driving benchmarks or planning setups.",Make zero-shot geographic transfer a standard evaluation and investigate domain-specific self-supervised pretraining for more robust planning.,abstract-level synthesis
2603.07083,Dreamer-CDP: Improving Reconstruction-free World Models Via Continuous Deterministic Representation Prediction,arxiv,2026-03-07T07:41:28Z,Michael Hauri; Friedemann Zenke,cs.LG,https://huggingface.co/papers/2603.07083,https://arxiv.org/abs/2603.07083,/root/workspace/jepa/pdfs/2603.07083.pdf,Reconstruction-free world models can remain competitive if they predict continuous deterministic representations with a JEPA-style objective instead of reconstructing pixels.,Introduces a JEPA-style predictor over continuous deterministic latent representations within a Dreamer-style model-based reinforcement learning setup and evaluates it on Crafter.,"The method matches Dreamer on Crafter, showing that effective world model learning is possible on this benchmark without reconstruction objectives.",The summary reports results on Crafter only and does not describe performance on additional environments or tasks.,Test JEPA-style reconstruction-free world models on a wider range of high-dimensional reinforcement-learning benchmarks.,abstract-level synthesis
2603.05924,Weak-SIGReg: Covariance Regularization for Stable Deep Learning,huggingface_papers;arxiv,2026-03-06T05:32:40Z,Habibullah Akbar,cs.LG,https://huggingface.co/papers/2603.05924,https://arxiv.org/abs/2603.05924,/root/workspace/jepa/pdfs/2603.05924.pdf,"SIGReg, introduced in LeJEPA, can serve as a general optimization stabilizer for supervised deep learning, and a covariance-focused weak variant preserves the benefit with lower cost.","Derives Weak-SIGReg as a random-sketching approximation that targets covariance structure, motivates it through a representation-collapse perspective, and evaluates it on ViTs and deep vanilla MLPs.",Weak-SIGReg recovers a collapsed ViT on CIFAR-100 from 20.73% to 72.02% accuracy and substantially improves convergence for deep vanilla MLPs trained with pure SGD.,"The summary centers on selected supervised settings and does not specify how uniformly the method works across broader architectures, datasets, or optimization regimes.",Apply Gaussian-constrained regularization more broadly as an architecture-agnostic training stabilizer and study its behavior in additional low-data or collapse-prone regimes.,abstract-level synthesis
2603.02650,Improving Diffusion Planners by Self-Supervised Action Gating with Energies,arxiv,2026-03-03T06:36:16Z,Yuan Lu; Dongqi Han; Yansen Wang; Dongsheng Li,cs.LG; cs.AI; cs.RO,https://huggingface.co/papers/2603.02650,https://arxiv.org/abs/2603.02650,/root/workspace/jepa/pdfs/2603.02650.pdf,"Diffusion planners need a feasibility signal beyond value estimates, and JEPA-based latent prediction error can provide an effective inference-time action gate.","Trains a JEPA encoder on offline state sequences together with an action-conditioned latent predictor, then re-ranks sampled trajectories by combining value scores with an energy based on latent prediction error.","SAGE improves the performance and robustness of diffusion planners across locomotion, navigation, and manipulation benchmarks without environment rollouts or policy retraining.",The method is described for diffusion planning pipelines that already sample candidate trajectories and score them with values; the summary does not address other planner classes.,Extend latent feasibility re-ranking to other offline planning pipelines and study its effects on harder long-horizon decision problems.,abstract-level synthesis
2602.23058,GeoWorld: Geometric World Models,huggingface_papers;arxiv,2026-02-26T14:42:53Z,Zeyu Zhang; Danning Li; Ian Reid; Richard Hartley,cs.CV; cs.RO,https://huggingface.co/papers/2602.23058,https://arxiv.org/abs/2602.23058,/root/workspace/jepa/pdfs/2602.23058.pdf,"Geometric structure matters in predictive world models, and hyperbolic JEPA representations can better preserve hierarchy and support longer-horizon visual planning.","Introduces GeoWorld with a Hyperbolic JEPA that maps Euclidean latents onto hyperbolic manifolds, plus geometric reinforcement learning for energy-based optimization, and evaluates on CrossTask and COIN.",GeoWorld improves success rate by about 3% in 3-step planning and 2% in 4-step planning relative to the state-of-the-art V-JEPA 2 baseline.,"The summary reports gains on CrossTask and COIN with short multi-step planning settings, and does not establish broader generality beyond those benchmarks.",Explore geometric latent spaces for longer-horizon planning and additional energy-based world-model applications.,abstract-level synthesis
2602.14672,MeFEm: Medical Face Embedding model,huggingface_papers;arxiv,2026-02-16T11:51:46Z,Yury Borets; Stepan Botman,cs.CV,https://huggingface.co/papers/2602.14672,https://arxiv.org/abs/2602.14672,/root/workspace/jepa/pdfs/2602.14672.pdf,A domain-adapted JEPA can produce strong facial embeddings for biometric and medical analysis even with less training data than major baselines.,"Builds MeFEm by modifying JEPA with axial stripe masking, circular loss weighting, and probabilistic CLS-token reassignment, then evaluates it on anthropometric tasks and BMI estimation from facial images.","MeFEm outperforms FaRL and Franca on core anthropometric tasks while using substantially less data, and it shows promising BMI-estimation results on a newly consolidated dataset.","The BMI evaluation relies on a closed-source dataset, and the summary focuses on selected anthropometric and BMI tasks rather than broader clinical deployment.",Use the released model as a baseline for broader facial medical-analysis work and develop better datasets that reduce domain bias.,abstract-level synthesis
2602.13507,Benchmarking Video Foundation Models for Remote Parkinson's Disease Screening,arxiv,2026-02-13T22:36:42Z,Md Saiful Islam; Ekram Hossain; Abdelrahman Abdelkader; Tariq Adnan; Fazla Rabbi Mashrur; Sooyong Park; Praveen Kumar; Qasim Sudais; Natalia Chunga; Nami Shah; Jan Freyberg; Christopher Kanan; Ruth Schneider; Ehsan Hoque,cs.CV,https://huggingface.co/papers/2602.13507,https://arxiv.org/abs/2602.13507,/root/workspace/jepa/pdfs/2602.13507.pdf,"Video foundation models can support remote Parkinson's screening, but model effectiveness depends strongly on the clinical task, so architecture choice should be task-aware.","Benchmarks seven state-of-the-art video foundation models on a new dataset of 1,888 participants across 16 standardized clinical tasks using frozen embeddings and a linear classification head.","VideoPrism is strongest for visual speech and facial expressivity, V-JEPA is best for upper-limb motor tasks, and TimeSformer remains competitive for rhythmic tasks. Results reach AUCs of 76.4-85.3% and accuracies of 71.5-80.6%, with high specificity but lower sensitivity.","Lower sensitivity limits standalone screening performance, and the summary explicitly points to the need for calibration and combining multiple tasks or modalities.",Develop task-aware model selection and integrate multiple tasks or modalities for stronger remote neurological screening systems.,abstract-level synthesis
2602.11322,Predictive Associative Memory: Retrieval Beyond Similarity Through Temporal Co-occurrence,arxiv,2026-02-11T19:51:22Z,Jason Dury,cs.LG; cs.AI; cs.IR; cs.NE,https://huggingface.co/papers/2602.11322,https://arxiv.org/abs/2602.11322,/root/workspace/jepa/pdfs/2602.11322.pdf,"Associative memory should retrieve states linked by temporal co-occurrence, not just representational similarity, and JEPA-style prediction can learn that associative structure.","Proposes Predictive Associative Memory with an Inward JEPA over stored experience paired with an Outward JEPA over incoming data, then evaluates associative recall on a synthetic benchmark against cosine similarity.","The model retrieves true temporal associates with high precision, recovers cross-boundary associations that cosine similarity misses, separates co-experienced from never-co-experienced states well, and remains stable across seeds. A temporal shuffle control supports that the signal comes from temporal co-occurrence.",The evaluation is on a synthetic benchmark and is framed around recall of experienced associations rather than generalization to unseen ones.,Apply temporally grounded associative retrieval to richer experience streams and more practical memory systems.,abstract-level synthesis
2602.05638,SurgMotion: A Video-Native Foundation Model for Universal Understanding of Surgical Videos,huggingface_papers;arxiv,2026-02-05T13:18:33Z,Jinlin Wu; Felix Holm; Chuxi Chen; An Wang; Yaxin Hu; Xiaofan Ye; Zelin Zang; Miao Xu; Lihua Zhou; Huai Liao; Danny T. M. Chan; Ming Feng; Wai S. Poon; Hongliang Ren; Dong Yi; Nassir Navab; Gaofeng Meng; Jiebo Luo; Hongbin Liu; Zhen Lei,cs.CV,https://huggingface.co/papers/2602.05638,https://arxiv.org/abs/2602.05638,/root/workspace/jepa/pdfs/2602.05638.pdf,"For surgical videos, latent motion prediction is a better pretraining signal than pixel reconstruction because it prioritizes semantic dynamics over low-level visual artifacts.","Builds SurgMotion on V-JEPA with motion-guided latent masked prediction, spatiotemporal affinity self-distillation, and feature-diversity regularization, then pretrains on the SurgMotion-15M dataset and evaluates across 17 benchmarks.","SurgMotion substantially outperforms prior methods across surgical workflow recognition, action triplet recognition, skill assessment, polyp segmentation, and depth estimation, positioning it as a strong universal surgical-video model.","The summary emphasizes benchmark gains and large-scale pretraining, but does not specify deployment constraints or behavior beyond the listed surgical tasks.","Extend motion-oriented surgical foundation modeling to additional procedures, tasks, and large-scale clinical video resources.",abstract-level synthesis
