paper_id,title,source,published,authors,categories,hf_papers_url,arxiv_url,local_pdf,principal_argument,methodology,main_findings,limitations_or_gaps,future_opportunities,notes
2604.21046,JEPAMatch: Geometric Representation Shaping for Semi-Supervised Learning,arxiv,2026-04-22T19:44:41Z,Ali Aghababaei-Harandi; Aude Sportisse; Massih-Reza Amini,cs.LG,https://huggingface.co/papers/2604.21046,https://arxiv.org/abs/2604.21046,/root/workspace/jepa/pdfs/2604.21046.pdf,"Semi-supervised learning can be improved by explicitly shaping latent geometry, not only by thresholded pseudo-labeling, using LeJEPA-inspired representation regularization.","Adds a latent-space regularization term derived from LeJEPA to the classical FlexMatch semi-supervised objective and evaluates the combined method on CIFAR-100, STL-10, and Tiny-ImageNet.","The method reportedly outperforms existing baselines across the tested datasets, converges faster, and reduces computational cost relative to standard FixMatch-style pipelines.",The abstract emphasizes limitations of prior FixMatch-style methods but does not specify concrete limitations of the proposed method.,Not explicitly stated in the abstract.,abstract-level synthesis
2604.17651,Infrastructure-Centric World Models: Bridging Temporal Depth and Spatial Breadth for Roadside Perception,arxiv,2026-04-19T22:50:32Z,Siyuan Meng; Chengbo Ai,cs.CV; cs.RO,https://huggingface.co/papers/2604.17651,https://arxiv.org/abs/2604.17651,/root/workspace/jepa/pdfs/2604.17651.pdf,"Infrastructure-centric world models offer a complementary alternative to ego-vehicle world models because fixed roadside systems provide persistent, multi-sensor temporal coverage.","Presents a three-phase roadmap for infrastructure-centric world models, a dual-layer architecture, a phased sensor strategy, a taxonomy of world-model paradigms, and the proposed Infrastructure VLA concept.","The paper positions infrastructure-centric modeling as a distinct opportunity, identifies open-source building blocks for each phase, and frames latent-space alignment for V2X collaboration as a key direction.",This is a vision and taxonomy paper; the abstract does not report a validated end-to-end empirical system.,"Develop the three proposed phases, collaborative V2X latent-space alignment, and the Infrastructure VLA framework.",abstract-level synthesis
2604.17228,Revisiting Auxiliary Losses for Conditional Depth Routing: An Empirical Study,arxiv,2026-04-19T03:20:40Z,Qingwei Lin,cs.LG,https://huggingface.co/papers/2604.17228,https://arxiv.org/abs/2604.17228,/root/workspace/jepa/pdfs/2604.17228.pdf,"Common auxiliary losses for conditional depth routing can be harmful under the studied setup, and the benefit of a JEPA-guided gate depends strongly on the supervision recipe.","Runs a controlled empirical comparison between an MLP gate and a JEPA-guided gate in a 157.5M-parameter decoder-only model with controller-only training, 50% full-path budget, three seeds, and ablations on auxiliary losses.","With util/rank supervision, the JEPA-guided gate improves early-to-mid optimization, but removing util/rank improves language-model loss and threshold-hit speed for both gates and cuts the training FLOPs proxy substantially.",The authors explicitly state that the conclusions are scoped to the studied regime.,The findings motivate alternative supervision strategies that better match gated execution instead of off-policy oracle labels.,abstract-level synthesis
2604.16585,The Global Neural World Model: Spatially Grounded Discrete Topologies for Action-Conditioned Planning,arxiv,2026-04-17T15:12:15Z,Noureddine Kermiche,cs.LG; cs.AI,https://huggingface.co/papers/2604.16585,https://arxiv.org/abs/2604.16585,/root/workspace/jepa/pdfs/2604.16585.pdf,"A continuous, action-conditioned JEPA with discrete spatial topology can support stable rollouts and structured planning without pixel-level reconstruction.","Introduces the Global Neural World Model, which maps environments to a discrete 2D grid using entropy-based topological quantization, translational equivariance, grid snapping, and maximum-entropy exploration via random walks.","The abstract claims the model prevents manifold drift during autoregressive rollouts and organizes continuous concepts into structured topological maps across passive, active, and abstract sequence settings.",The abstract does not describe specific failure cases or detailed benchmark comparisons beyond broad validation claims.,Not explicitly stated in the abstract.,abstract-level synthesis
2604.16086,Stylistic-STORM (ST-STORM) : Perceiving the Semantic Nature of Appearance,arxiv,2026-04-17T14:15:12Z,Hamed Ouattara; Pierre Duthon; Pascal Houssam Salmane; Frédéric Bernardin; Omar Ait Aider,cs.CV; cs.AI; cs.LG; stat.ML,https://huggingface.co/papers/2604.16086,https://arxiv.org/abs/2604.16086,/root/workspace/jepa/pdfs/2604.16086.pdf,Appearance should be treated as semantic signal rather than nuisance when tasks depend on style cues such as weather effects or clinical appearance.,"Proposes ST-STORM, a hybrid self-supervised framework with separate content and style latent streams, using a JEPA-plus-contrastive content branch and a prediction/reconstruction-based style branch under adversarial constraint.",The style branch reportedly isolates complex appearance phenomena with strong results on weather and ISIC tasks while preserving content-branch semantic performance on ImageNet-1K.,The abstract reports headline metrics but does not spell out specific limitations of the approach.,Not explicitly stated in the abstract.,abstract-level synthesis
2604.13518,From Alignment to Prediction: A Study of Self-Supervised Learning and Predictive Representation Learning,arxiv,2026-04-15T06:04:45Z,Mintu Dutta; Ritesh Vyas; Mohendra Roy,cs.LG; cs.AI,https://huggingface.co/papers/2604.13518,https://arxiv.org/abs/2604.13518,/root/workspace/jepa/pdfs/2604.13518.pdf,"Predictive Representation Learning is a distinct self-supervised paradigm centered on latent prediction of unobserved data, with JEPA as a representative example.","Defines a taxonomy spanning alignment, reconstruction, and predictive representation learning, and implements BYOL, MAE, and I-JEPA for comparative analysis.","The paper argues for PRL as a promising direction and reports that MAE achieves perfect similarity but weaker robustness, while BYOL and I-JEPA trade slightly lower reported accuracy for stronger robustness.",The abstract highlights theoretical questions and open challenges in predictive representation learning rather than detailing specific study limitations.,Further work on the theoretical perspectives and open challenges of predictive representation learning.,abstract-level synthesis
2604.11751,Grounded World Model for Semantically Generalizable Planning,arxiv,2026-04-13T17:25:41Z,Quanyi Li; Lan Feng; Haonan Zhang; Wuyang Li; Letian Wang; Alexandre Alahi; Harold Soh,cs.RO; cs.AI,https://huggingface.co/papers/2604.11751,https://arxiv.org/abs/2604.11751,/root/workspace/jepa/pdfs/2604.11751.pdf,World models grounded in a vision-language-aligned latent space can let model-predictive control use natural-language task instructions instead of goal images and improve semantic generalization.,"Learns a Grounded World Model whose predicted future outcomes are scored by embedding similarity to a task instruction, and evaluates the resulting GWM-MPC system on the WISER benchmark.","GWM-MPC achieves an 87% success rate on 288 test tasks with unseen visual signals and referring expressions, versus an average 22% success rate for traditional VLAs.",The abstract motivates the method using shortcomings of goal-image conditioning but does not identify concrete limitations of the proposed model itself.,Not explicitly stated in the abstract.,abstract-level synthesis
2604.11364,The Missing Knowledge Layer in Cognitive Architectures for AI Agents,huggingface_papers;arxiv,2026-04-13T12:05:30Z,Michaël Roynard,cs.AI,https://huggingface.co/papers/2604.11364,https://arxiv.org/abs/2604.11364,/root/workspace/jepa/pdfs/2604.11364.pdf,AI cognitive architectures need an explicit knowledge layer with its own persistence semantics; otherwise factual knowledge and episodic memory are handled incorrectly.,"Surveys persistence semantics across memory systems, identifies convergence points across prior work, proposes a four-layer decomposition, and includes companion implementations in Python and Rust.",The paper argues that current frameworks such as CoALA and JEPA lack this separation and that distinct persistence semantics are necessary for engineering implementations.,The abstract is primarily architectural and argumentative; it does not report benchmark-style empirical validation beyond feasibility demonstrations.,"Design agent systems that implement separate persistence semantics for knowledge, memory, wisdom, and intelligence.",abstract-level synthesis
2604.10591,GeoMeld: Toward Semantically Grounded Foundation Models for Remote Sensing,huggingface_papers;arxiv,2026-04-12T11:47:11Z,Maram Hasan; Md Aminur Hossain; Savitra Roy; Souparna Bhowmik; Ayush V. Patel; Mainak Singha; Subhasis Chaudhuri; Muhammad Haris Khan; Biplab Banerjee,cs.CV; cs.AI,https://huggingface.co/papers/2604.10591,https://arxiv.org/abs/2604.10591,/root/workspace/jepa/pdfs/2604.10591.pdf,"Remote-sensing foundation models need large-scale aligned multimodal data and grounded language supervision, which GeoMeld and GeoMeld-FM are intended to provide.","Builds a roughly 2.5 million-sample multimodal dataset with agentic captioning and introduces a pretraining framework combining masked autoencoding, JEPA representation learning, and caption-vision contrastive alignment.",The abstract reports consistent gains in downstream transfer and cross-sensor robustness and presents the dataset-framework pair as a scalable reference for the field.,The abstract emphasizes limitations of prior remote-sensing resources but does not specify concrete limitations of GeoMeld or GeoMeld-FM.,Extend semantically grounded multimodal foundation modeling in remote sensing using this scalable reference framework.,abstract-level synthesis
2604.10514,Data-Efficient Surgical Phase Segmentation in Small-Incision Cataract Surgery: A Controlled Study of Vision Foundation Models,arxiv,2026-04-12T08:07:02Z,Lincoln Spencer; Song Wang; Chen Chen,cs.CV; cs.AI,https://huggingface.co/papers/2604.10514,https://arxiv.org/abs/2604.10514,/root/workspace/jepa/pdfs/2604.10514.pdf,Large self-supervised vision foundation models can improve low-label surgical phase segmentation when evaluated under a controlled temporal-model setup.,Compares supervised encoders and foundation models including DINOv3 and V-JEPA2 by pairing each with the same MS-TCN++ temporal model on SICS-155 and using a cached-feature pipeline.,"Foundation-model features improve segmentation performance, with DINOv3 ViT-7B achieving the best reported results at 83.4% accuracy and an 87.0 edit score.","The abstract notes that cataract-domain transfer and lightweight adaptation can help or hurt, but it does not provide detailed failure analysis.",Not explicitly stated in the abstract.,abstract-level synthesis
2604.08960,Efficient Hierarchical Implicit Flow Q-learning for Offline Goal-conditioned Reinforcement Learning,arxiv,2026-04-10T05:04:29Z,Zhiqiang Dong; Teng Pang; Rongjian Xu; Guoqiang Wu,cs.LG,https://huggingface.co/papers/2604.08960,https://arxiv.org/abs/2604.08960,/root/workspace/jepa/pdfs/2604.08960.pdf,More expressive hierarchical policies and more discriminative goal representations can improve offline goal-conditioned reinforcement learning on long-horizon tasks.,Introduces a goal-conditioned mean flow policy for high- and low-level policies and adds a LeJEPA loss that repels goal embeddings during training; evaluates on state-based and pixel-based OGBench tasks.,The method is reported to achieve strong performance across both state-based and pixel-based benchmarks.,The abstract describes shortcomings of prior methods but does not specify concrete limitations of the proposed approach.,Not explicitly stated in the abstract.,abstract-level synthesis
2604.08065,Multimodal Latent Reasoning via Predictive Embeddings,arxiv,2026-04-09T10:27:32Z,Ashutosh Adhikari; Mirella Lapata,cs.LG,https://huggingface.co/papers/2604.08065,https://arxiv.org/abs/2604.08065,/root/workspace/jepa/pdfs/2604.08065.pdf,Predictive embedding learning in latent space can replace explicit tool calls at inference time for multimodal reasoning while preserving standard VLM generation pipelines.,"Proposes Pearl, a JEPA-inspired method that learns from expert tool-use trajectories entirely in latent space, and compares it with supervised fine-tuning and reconstruction-based latent reasoning on perception benchmarks.","Pearl reportedly matches or outperforms the comparison methods, and the study argues that reconstruction-based latent reasoning mainly learns embeddings rather than image edits.",The abstract critiques prior tool-augmented and reconstruction-based approaches but does not identify explicit limitations of Pearl itself.,The results motivate predictive embedding learning as an alternative to reconstruction-based latent reasoning for multimodal systems.,abstract-level synthesis
2604.05767,Beyond the Beep: Scalable Collision Anticipation and Real-Time Explainability with BADAS-2.0,arxiv,2026-04-07T12:10:21Z,Roni Goldshmidt; Hamish Scott; Lorenzo Niccolini; Hernan Matzner,cs.CV; cs.CL,https://huggingface.co/papers/2604.05767,https://arxiv.org/abs/2604.05767,/root/workspace/jepa/pdfs/2604.05767.pdf,"Scaling data curation, domain-specific self-supervised pretraining, distillation, and explainability together can materially improve collision anticipation systems.","Expands labeled data using BADAS-1.0 as an active oracle plus targeted collection, pretrains on 2.25 million unlabeled driving videos, distills to compact edge models, and adds attention heatmaps and a vision-language reasoning module.","BADAS-2.0 reports consistent gains across long-tail subgroups, the largest improvements on the hardest cases, 7-12x speedups with near-parity accuracy for distilled edge models, and real-time explanatory outputs.",The abstract focuses on reported gains and released assets rather than discussing explicit limitations of the system.,"Public benchmarks, inference code, and the BADAS-Reason setup create opportunities for further work on explainable driver-assistance systems.",abstract-level synthesis
2604.01349,PI-JEPA: Label-Free Surrogate Pretraining for Coupled Multiphysics Simulation via Operator-Split Latent Prediction,arxiv,2026-04-01T20:02:56Z,Brandon Yee; Pairie Koh,cs.LG; cs.CE; physics.comp-ph,https://huggingface.co/papers/2604.01349,https://arxiv.org/abs/2604.01349,/root/workspace/jepa/pdfs/2604.01349.pdf,Label-free pretraining on unlabeled reservoir parameter fields can substantially reduce the labeled simulation budget for multiphysics neural surrogates.,"PI-JEPA uses masked latent prediction on unlabeled parameter fields with per-sub-operator PDE residual regularization, with a predictor bank aligned to Lie-Trotter operator splitting and separate latent modules for pressure, saturation transport, and reaction before fine-tuning on limited labeled runs.","On single-phase Darcy flow, PI-JEPA reports 1.9x lower error than FNO and 2.4x lower error than DeepONet at 100 labeled runs, plus a 24% gain over supervised-only training at 500 labeled runs.","The abstract-level evidence is centered on single-phase Darcy flow and low-label fine-tuning settings, so broader multiphysics generalization is not established here.",Test the pretraining scheme on broader multiphysics operators and more realistic reservoir simulation settings.,abstract-level synthesis
2604.00394,Deep Networks Favor Simple Data,arxiv,2026-04-01T02:23:21Z,Weyl Lu; Chenjie Hao; Yubei Chen,cs.LG; cs.AI,https://huggingface.co/papers/2604.00394,https://arxiv.org/abs/2604.00394,/root/workspace/jepa/pdfs/2604.00394.pdf,The classic OOD density anomaly reflects a broader pattern: deep networks across architectures and density estimators systematically assign higher density to simpler data.,"Separates the trained network from the density estimator, introduces Jacobian-based and autoregressive self-estimators, and studies multiple model families including I-JEPA with external complexity metrics.","The study finds highly consistent density rankings favoring simpler samples within datasets and across OOD pairs, with strong agreement across independently trained models and with complexity metrics.","The authors explicitly state that the goal is to define and visualize the question more clearly, not to settle it completely.","Further investigate why deep networks favor simple data across architectures, objectives, and density estimators.",abstract-level synthesis
2604.00383,Mine-JEPA: In-Domain Self-Supervised Learning for Mine-Like Object Classification in Side-Scan Sonar,arxiv,2026-04-01T02:08:07Z,Taeyoun Kwon; Youngwon Choi; Hyeonyu Kim; Myeongkyun Cho; Junhyeok Choi; Moon Hwan Kim,cs.CV,https://huggingface.co/papers/2604.00383,https://arxiv.org/abs/2604.00383,/root/workspace/jepa/pdfs/2604.00383.pdf,Carefully designed in-domain self-supervised learning can outperform far larger general-purpose vision foundation models for side-scan sonar mine classification under data scarcity.,"Mine-JEPA pretrains with the SIGReg self-supervised loss on 1,170 unlabeled sonar images, then evaluates binary and 3-class mine-like object classification, including a compact ViT-Tiny setting and synthetic data augmentation.","The method reaches F1 0.935 for mine vs. non-mine and 0.820 for 3-class classification with augmentation, outperforming fine-tuned DINOv3 in both settings; applying in-domain SSL to foundation models degrades performance by 10 to 13 points, and the compact backbone remains competitive with 4x fewer parameters.",The summary is limited to side-scan sonar classification with a small unlabeled corpus and binary/3-class tasks.,Evaluate the approach on broader sonar datasets and clarify when domain adaptation helps or harms stronger pretrained models.,abstract-level synthesis
2603.29966,Scaling Video Pretraining for Surgical Foundation Models,arxiv,2026-03-31T16:31:25Z,Sicheng Lu; Zikai Xiao; Jianhui Wei; Danyu Sun; Qi Lu; Keli Hu; Yang Feng; Jian Wu; Zongxin Yang; Zuozhu Liu,cs.CV,https://huggingface.co/papers/2603.29966,https://arxiv.org/abs/2603.29966,/root/workspace/jepa/pdfs/2603.29966.pdf,"Surgical video understanding needs a scalable and reproducible pretraining recipe and benchmark, and JEPA-based pretraining is a strong candidate foundation.","Curates a 10,535-video, 214.5 million-frame corpus, develops a unified pretraining pipeline and standardized benchmark across 16 downstream datasets, and instantiates SurgRec-MAE and SurgRec-JEPA.","SurgRec consistently outperforms self-supervised baselines and vision-language models across downstream datasets, while the abstract notes that VLMs are unreliable for fine-grained temporal recognition and sensitive to prompt phrasing.",The abstract emphasizes limitations of prior surgical foundation models but does not specify concrete limitations of SurgRec itself.,"The released recipe, models, and benchmark are positioned as a foundation for building more general surgical video models.",abstract-level synthesis
2603.29796,JEPA-MSAC: A Joint-Embedding Predictive Architecture for Multimodal Sensing-Assisted Communications,arxiv,2026-03-31T14:29:42Z,Can Zheng; Jiguang He; Guofa Cai; Nannan Li; Mehdi Bennis; Henk Wymeersch; Merouane Debbah,eess.SP,https://huggingface.co/papers/2603.29796,https://arxiv.org/abs/2603.29796,/root/workspace/jepa/pdfs/2603.29796.pdf,A shared self-supervised multimodal predictive backbone can support several wireless PHY tasks with lower adaptation cost than task-specific supervised pipelines.,"JEPA-MSAC maps multimodal sensing and communication measurements into a unified token space, pretrains a shared backbone with temporal block-masked JEPA, then freezes that backbone and trains lightweight heads for localization, beam prediction, and RSSI prediction.","The learned latent state supports accurate multi-task prediction with low adaptation cost, and ablations highlight scaling behavior and the effect of key pretraining choices.",The abstract does not provide headline numerical gains and focuses on a specific set of wireless prediction tasks.,"Extend the framework to more sensing modalities, communication settings, and downstream PHY tasks.",abstract-level synthesis
2603.27134,Semantic Interaction Information mediates compositional generalization in latent space,arxiv,2026-03-28T04:46:44Z,John Schwarcz,cs.LG,https://huggingface.co/papers/2603.27134,https://arxiv.org/abs/2603.27134,/root/workspace/jepa/pdfs/2603.27134.pdf,"Compositional generalization in latent-space tasks depends on modeling interactions among relevant latent variables, and Semantic Interaction Information captures how much those interactions matter for performance.","Frames compositional generalization as variational inference over interacting latent variables, introduces the Cognitive Gridworld POMDP and the Semantic Interaction Information metric, analyzes RNN variants, and proposes Representation Classification Chains with separate RL-based inference and self-supervised embedding modules.","Semantic Interaction Information explains the accuracy gap between Echo State and fully trained networks, reveals a confidence-versus-accuracy failure mode, and the proposed RCC architecture generalizes to novel combinations of relevant variables.","The hard regime exposes a circular dependence between inferring latent variables and learning their interactions, and the evidence summarized in the abstract is centered on the Cognitive Gridworld setting.","Use Cognitive Gridworld as a benchmark for continual meta-learning and goal-directed generalist agents, and extend RCC-style disentangling of inference and embeddings to richer environments.",abstract-level synthesis
2603.25981,Policy-Guided World Model Planning for Language-Conditioned Visual Navigation,arxiv,2026-03-26T23:47:49Z,Amirhosein Chahe; Lifeng Zhou,cs.RO; cs.AI; cs.CL,https://huggingface.co/papers/2603.25981,https://arxiv.org/abs/2603.25981,/root/workspace/jepa/pdfs/2603.25981.pdf,Policy-guided initialization can make latent world-model planning more effective for language-conditioned visual navigation than either reactive policies or uninformed planning alone.,"Builds PiJEPA as a two-stage system: an Octo-based navigation policy conditioned on frozen DINOv2 or V-JEPA-2 features is finetuned on CAST, then its action distribution warm-starts MPPI planning over a separately trained JEPA world model in the same latent space.","Using the policy prior speeds planner convergence and improves goal-reaching and instruction-following, with PiJEPA outperforming standalone policy execution and uninformed world-model planning on real-world navigation tasks.","The abstract focuses on CAST-based training and real-world navigation evaluation, while broader task coverage and system tradeoffs beyond this two-stage setup are not detailed.",Test the policy-guided planning recipe on broader embodied tasks and continue exploring how encoder choice affects both policy and world-model components.,abstract-level synthesis
2603.25841,GazeQwen: Lightweight Gaze-Conditioned LLM Modulation for Streaming Video Understanding,arxiv,2026-03-26T19:03:49Z,Trong Thang Pham; Hien Nguyen; Ngan Le,cs.CV; cs.AI,https://huggingface.co/papers/2603.25841,https://arxiv.org/abs/2603.25841,/root/workspace/jepa/pdfs/2603.25841.pdf,Learning gaze-conditioned hidden-state modulation is a more effective way to inject eye-gaze information into multimodal video models than prompt-style overlays or simply scaling model size.,"Introduces GazeQwen, where a small gaze resampler combines V-JEPA 2.1 video features with fixation-based positional encodings and injects additive residuals into selected Qwen decoder layers, with an optional LoRA refinement stage, then evaluates on all StreamGaze tasks.","GazeQwen reaches 63.9% accuracy on StreamGaze, outperforming the same backbone using gaze prompts by 16.1 points and GPT-4o by 10.5 points, the best result reported in the abstract.","The evidence in the abstract is concentrated on the StreamGaze benchmark, and it does not spell out deployment or latency tradeoffs beyond describing the approach as lightweight.",Apply gaze-conditioned layer modulation to other streaming video or multimodal reasoning settings and study which injection locations are most useful.,abstract-level synthesis
