paper_id,title,source,published,authors,categories,hf_papers_url,arxiv_url,local_pdf,principal_argument,methodology,main_findings,limitations_or_gaps,future_opportunities,notes
2604.01349,PI-JEPA: Label-Free Surrogate Pretraining for Coupled Multiphysics Simulation via Operator-Split Latent Prediction,arxiv,2026-04-01T20:02:56Z,Brandon Yee; Pairie Koh,cs.LG; cs.CE; physics.comp-ph,https://huggingface.co/papers/2604.01349,https://arxiv.org/abs/2604.01349,/root/workspace/jepa/pdfs/2604.01349.pdf,Label-free pretraining on unlabeled reservoir parameter fields can substantially reduce the labeled simulation budget for multiphysics neural surrogates.,"PI-JEPA uses masked latent prediction on unlabeled parameter fields with per-sub-operator PDE residual regularization, with a predictor bank aligned to Lie-Trotter operator splitting and separate latent modules for pressure, saturation transport, and reaction before fine-tuning on limited labeled runs.","On single-phase Darcy flow, PI-JEPA reports 1.9x lower error than FNO and 2.4x lower error than DeepONet at 100 labeled runs, plus a 24% gain over supervised-only training at 500 labeled runs.","The abstract-level evidence is centered on single-phase Darcy flow and low-label fine-tuning settings, so broader multiphysics generalization is not established here.",Test the pretraining scheme on broader multiphysics operators and more realistic reservoir simulation settings.,abstract-level synthesis
2604.00383,Mine-JEPA: In-Domain Self-Supervised Learning for Mine-Like Object Classification in Side-Scan Sonar,arxiv,2026-04-01T02:08:07Z,Taeyoun Kwon; Youngwon Choi; Hyeonyu Kim; Myeongkyun Cho; Junhyeok Choi; Moon Hwan Kim,cs.CV,https://huggingface.co/papers/2604.00383,https://arxiv.org/abs/2604.00383,/root/workspace/jepa/pdfs/2604.00383.pdf,Carefully designed in-domain self-supervised learning can outperform far larger general-purpose vision foundation models for side-scan sonar mine classification under data scarcity.,"Mine-JEPA pretrains with the SIGReg self-supervised loss on 1,170 unlabeled sonar images, then evaluates binary and 3-class mine-like object classification, including a compact ViT-Tiny setting and synthetic data augmentation.","The method reaches F1 0.935 for mine vs. non-mine and 0.820 for 3-class classification with augmentation, outperforming fine-tuned DINOv3 in both settings; applying in-domain SSL to foundation models degrades performance by 10 to 13 points, and the compact backbone remains competitive with 4x fewer parameters.",The summary is limited to side-scan sonar classification with a small unlabeled corpus and binary/3-class tasks.,Evaluate the approach on broader sonar datasets and clarify when domain adaptation helps or harms stronger pretrained models.,abstract-level synthesis
2603.29796,JEPA-MSAC: A Joint-Embedding Predictive Architecture for Multimodal Sensing-Assisted Communications,arxiv,2026-03-31T14:29:42Z,Can Zheng; Jiguang He; Guofa Cai; Nannan Li; Mehdi Bennis; Henk Wymeersch; Merouane Debbah,eess.SP,https://huggingface.co/papers/2603.29796,https://arxiv.org/abs/2603.29796,/root/workspace/jepa/pdfs/2603.29796.pdf,A shared self-supervised multimodal predictive backbone can support several wireless PHY tasks with lower adaptation cost than task-specific supervised pipelines.,"JEPA-MSAC maps multimodal sensing and communication measurements into a unified token space, pretrains a shared backbone with temporal block-masked JEPA, then freezes that backbone and trains lightweight heads for localization, beam prediction, and RSSI prediction.","The learned latent state supports accurate multi-task prediction with low adaptation cost, and ablations highlight scaling behavior and the effect of key pretraining choices.",The abstract does not provide headline numerical gains and focuses on a specific set of wireless prediction tasks.,"Extend the framework to more sensing modalities, communication settings, and downstream PHY tasks.",abstract-level synthesis
2603.24327,Le MuMo JEPA: Multi-Modal Self-Supervised Representation Learning with Learnable Fusion Tokens,arxiv,2026-03-25T14:09:59Z,Ciem Cornelissen; Sam Leroux; Pieter Simoens,cs.CV,https://huggingface.co/papers/2603.24327,https://arxiv.org/abs/2603.24327,/root/workspace/jepa/pdfs/2603.24327.pdf,Learnable fusion-token bottlenecks can make multimodal JEPA training efficient while preserving strong downstream performance across aligned sensor pairs.,"Le MuMo JEPA extends LeJEPA with modality-specific patch stems, a shared transformer, learnable fusion tokens, pruned fusion after early cross-modal attention, and SIGReg on the joint multimodal CLS embedding; it is tested on RGB-depth and RGB-thermal settings.","The model gives the strongest performance-efficiency trade-off among from-scratch multimodal baselines on Waymo, remains strongest under from-scratch training on nuScenes, and achieves the best FLIR results, especially after Waymo-initialized fine-tuning, while using less compute and memory.","The demonstrated scope is aligned RGB-depth and RGB-thermal perception benchmarks, so broader modality mixes are not covered in the summary.",Apply the fusion-token design to additional sensor combinations and transfer settings beyond driving benchmarks.,abstract-level synthesis
2603.20111,Var-JEPA: A Variational Formulation of the Joint-Embedding Predictive Architecture -- Bridging Predictive and Generative Self-Supervised Learning,arxiv,2026-03-20T16:36:29Z,Moritz Gögl; Christopher Yau,cs.LG; cs.AI,https://huggingface.co/papers/2603.20111,https://arxiv.org/abs/2603.20111,/root/workspace/jepa/pdfs/2603.20111.pdf,"JEPA can be cast as a variational latent-variable model, and making that structure explicit yields a more principled predictive self-supervised objective with uncertainty estimates.","Var-JEPA derives a single-ELBO formulation from coupled latent-variable models, replacing heuristic anti-collapse regularization with an explicit variational objective; the paper instantiates this as Var-T-JEPA for tabular data.","The framework produces meaningful representations without ad hoc anti-collapse regularizers, enables principled latent uncertainty quantification, and consistently improves over T-JEPA on tabular tasks while staying competitive with strong raw-feature baselines.","The abstracted evidence is for tabular data, so effectiveness on vision, audio, or video settings is not established here.",Extend the variational JEPA formulation to other modalities and study uncertainty-aware downstream uses.,abstract-level synthesis
2603.14482,V-JEPA 2.1: Unlocking Dense Features in Video Self-Supervised Learning,huggingface_papers;arxiv,2026-03-15T17:02:40Z,Lorenzo Mur-Labadia; Matthew Muckley; Amir Bar; Mido Assran; Koustuv Sinha; Mike Rabbat; Yann LeCun; Nicolas Ballas; Adrien Bardes,cs.CV,https://huggingface.co/papers/2603.14482,https://arxiv.org/abs/2603.14482,/root/workspace/jepa/pdfs/2603.14482.pdf,"Dense predictive objectives, hierarchical self-supervision, multimodal tokenization, and scale can substantially improve JEPA-style visual world modeling for images and videos.","V-JEPA 2.1 combines a dense masking-based predictive loss over visible and masked tokens, deep supervision across intermediate encoder layers, unified tokenizers for images and videos, and scaling in data and model size.","The model achieves state-of-the-art benchmark results including 7.71 mAP on Ego4D short-term object-interaction anticipation, 40.8 Recall@5 on EPIC-KITCHENS high-level action anticipation, and a 20-point gain in real-robot grasping success over V-JEPA-2 AC, alongside strong navigation, depth, and recognition performance.","The summary emphasizes benchmark wins on the studied image, video, and robotics tasks without detailing failure modes or narrower deployment constraints.","Scale the dense-feature recipe further and apply it to additional embodied, video-understanding, and robot-perception tasks.",abstract-level synthesis
2603.14131,Is the reconstruction loss culprit? An attempt to outperform JEPA,arxiv,2026-03-14T21:39:56Z,Alexey Potapov; Oleg Shcherbakov; Ivan Kravchenko,cs.LG,https://huggingface.co/papers/2603.14131,https://arxiv.org/abs/2603.14131,/root/workspace/jepa/pdfs/2603.14131.pdf,"JEPA may not owe its advantage purely to avoiding reconstruction loss; objective asymmetries and predictable-component selection also matter, and gated predictive autoencoders can surpass it on the studied toy system.","The paper compares JEPA-style predictive learning and reconstruction autoencoders on a controlled linear dynamical-system toy problem, performs diagnostic analyses with PCA baselines, and introduces gated predictive autoencoders that select predictable components.","The apparent JEPA robustness advantage to noise weakens under closer diagnostics, and the proposed gated predictive autoencoder is stable across noise levels while matching or outperforming JEPA on the toy benchmark.",Results are explicitly confined to a toy linear dynamical system rather than real-world high-dimensional datasets.,Test whether the gated predictive-autoencoder idea transfers to more realistic nonlinear representation-learning settings.,abstract-level synthesis
2603.13943,Sat-JEPA-Diff: Bridging Self-Supervised Learning and Generative Diffusion for Remote Sensing,huggingface_papers;arxiv,2026-03-14T13:30:49Z,Kursat Komurcu; Linas Petkevicius,cs.CV; cs.LG,https://huggingface.co/papers/2603.13943,https://arxiv.org/abs/2603.13943,/root/workspace/jepa/pdfs/2603.13943.pdf,Combining JEPA-style semantic prediction with diffusion generation can better balance structural fidelity and texture realism in satellite-image forecasting.,"Sat-JEPA-Diff uses an IJEPA module to predict stable semantic representations and conditions a frozen Stable Diffusion backbone through a lightweight cross-attention adapter, with evaluation on a global Sentinel-2 dataset.","The method produces sharper boundaries, attains leading perceptual scores including GSSIM 0.8984 and FID 0.1475, and outperforms deterministic baselines despite standard autoregressive stability limits.",The reported evidence is tied to Sentinel-2 remote sensing and the summary still notes autoregressive stability limits.,Assess the approach on more remote-sensing regimes and further improve long-horizon stability.,abstract-level synthesis
2603.19312,LeWorldModel: Stable End-to-End Joint-Embedding Predictive Architecture from Pixels,huggingface_papers;arxiv,2026-03-13T19:48:14Z,Lucas Maes; Quentin Le Lidec; Damien Scieur; Yann LeCun; Randall Balestriero,cs.LG; cs.AI,https://huggingface.co/papers/2603.19312,https://arxiv.org/abs/2603.19312,/root/workspace/jepa/pdfs/2603.19312.pdf,"End-to-end JEPA world models can be trained stably from pixels with a very simple objective, avoiding the heavy stabilization machinery used by prior approaches.","LeWorldModel trains from raw pixels using only a next-embedding prediction loss and a Gaussian latent regularizer, with roughly 15M parameters on a single GPU, then evaluates control performance plus physical probing and surprise detection.","The method is presented as the first JEPA to train stably end-to-end from raw pixels with only two loss terms, cuts tunable loss hyperparameters from six to one versus the only existing end-to-end alternative, plans up to 48x faster than foundation-model-based world models, and remains competitive across varied 2D and 3D control tasks.",The abstract-level evidence is centered on control benchmarks and does not establish performance across broader world-modeling domains.,Apply the simplified end-to-end JEPA recipe to additional environments and downstream planning or anomaly-detection settings.,abstract-level synthesis
2603.02263,Social-JEPA: Emergent Geometric Isomorphism,arxiv,2026-02-28T07:54:43Z,Haoran Zhang; Youjin Wang; Yi Duan; Rong Fu; Dianyu Zhao; Sicheng Fan; Shuaishuai Cao; Wentao Guo; Xiao Zhou,cs.CV; cs.AI,https://huggingface.co/papers/2603.02263,https://arxiv.org/abs/2603.02263,/root/workspace/jepa/pdfs/2603.02263.pdf,"Independent agents can learn latent spaces that become approximately isometric when trained predictively on the same world, enabling direct cross-agent transfer.","Separate agents learn world models from different viewpoints without coordination or parameter sharing; the paper then analyzes latent-space geometry, zero-update classifier transfer, and distillation-like migration between agents.","The learned latent spaces exhibit an approximate linear isometry despite large viewpoint shifts and limited pixel overlap, allowing classifier transfer without extra gradient steps and reducing later learning compute through migration.","The setup focuses on agents observing the same environment from different viewpoints, so broader interoperability claims remain limited at the abstract level.","Probe whether the emergent alignment persists across more heterogeneous agents, tasks, and environments.",withdrawn
2602.22617,Semantic Tube Prediction: Beating LLM Data Efficiency with JEPA,arxiv,2026-02-26T04:45:07Z,Hai Huang; Yann LeCun; Randall Balestriero,cs.LG,https://huggingface.co/papers/2602.22617,https://arxiv.org/abs/2602.22617,/root/workspace/jepa/pdfs/2602.22617.pdf,A JEPA-style geometric regularizer for language hidden states can dramatically improve LLM data efficiency beyond standard scaling-law expectations.,"The paper introduces the Geodesic Hypothesis and Semantic Tube Prediction, which constrains hidden-state trajectories to a tubular neighborhood around a semantic geodesic, serving as a JEPA-style regularizer without explicit multi-view augmentations.","Semantic Tube Prediction improves signal-to-noise ratio, preserves diversity by preventing trajectory collisions during inference, and matches baseline accuracy with 16x less training data on NL-RX-SYNTH.","The reported evidence is on NL-RX-SYNTH, so broader language benchmarks and model scales are not covered in the summary.",Test the geometric regularizer on wider LLM workloads and study how semantic-manifold priors interact with scaling laws.,abstract-level synthesis
2603.13265,"Knowledge, Rules and Their Embeddings: Two Paths towards Neuro-Symbolic JEPA",arxiv,2026-02-25T22:31:46Z,Yongchao Huang; Hassan Raza,cs.LG,https://huggingface.co/papers/2603.13265,https://arxiv.org/abs/2603.13265,/root/workspace/jepa/pdfs/2603.13265.pdf,JEPA can bridge statistical learning and symbolic reasoning by both injecting rule structure into predictive representations and relaxing rules into continuous spaces for generation and discovery.,"The proposed RiJEPA framework adds Energy-Based Constraints and a multimodal dual-encoder to encode logical biases, then uses differentiable rule relaxations with gradient-guided Langevin diffusion for continuous rule discovery, conditional generation, and inference.","Empirical evaluations on synthetic topological simulations and a clinical use case are reported to confirm the framework's efficacy and support robust, generative, and interpretable neuro-symbolic representation learning.",The summary does not report quantitative results and only names synthetic and one clinical use case as evidence.,Validate the framework on broader neuro-symbolic domains and further study scalable rule discovery and interpretability.,abstract-level synthesis
2602.19322,US-JEPA: A Joint Embedding Predictive Architecture for Medical Ultrasound,huggingface_papers;arxiv,2026-02-22T19:56:56Z,Ashwath Radhachandran; Vedrana Ivezić; Shreeram Athreya; Ronit Anilkumar; Corey W. Arnold; William Speier,cs.CV; cs.AI; cs.LG,https://huggingface.co/papers/2602.19322,https://arxiv.org/abs/2602.19322,/root/workspace/jepa/pdfs/2602.19322.pdf,"For ultrasound, predicting masked latent targets from a frozen domain-specific teacher offers a more stable and efficient self-supervised route than reconstruction or EMA-teacher JEPA variants.","US-JEPA applies the SALT objective with a frozen domain-specific teacher, decoupling student and teacher optimization, and benchmarks representation quality through linear probing across multiple UltraBench classification tasks against available ultrasound foundation models.","US-JEPA achieves competitive or superior linear-probe results relative to domain-specific and universal vision foundation model baselines, supporting masked latent prediction as a stable path for ultrasound representation learning.","The abstract centers on UltraBench linear-probe classification, so broader downstream clinical tasks are not detailed.",Extend the frozen-teacher JEPA approach to more ultrasound tasks and other medical-imaging settings.,abstract-level synthesis
2602.17162,JEPA-DNA: Grounding Genomic Foundation Models through Joint-Embedding Predictive Architectures,arxiv,2026-02-19T08:20:51Z,Ariel Larey; Elay Dahan; Amit Bleiweiss; Raizy Kellerman; Guy Leib; Omri Nayshool; Dan Ofer; Tal Zinger; Dan Dominissini; Gideon Rechavi; Nicole Bussola; Simon Lee; Shane O'Connell; Dung Hoang; Marissa Wirth; Alexander W. Charney; Nati Daniel; Yoli Shavit,cs.AI; q-bio.GN,https://huggingface.co/papers/2602.17162,https://arxiv.org/abs/2602.17162,/root/workspace/jepa/pdfs/2602.17162.pdf,Adding JEPA-style latent grounding to genomic pretraining can capture higher-level functional context that MLM or next-token prediction alone tends to miss.,JEPA-DNA combines standard generative objectives with latent-space supervision on a CLS token so the model predicts functional embeddings of masked genomic segments; it can be used from scratch or as continual pretraining for existing genomic foundation models.,"Across diverse genomic benchmarks, JEPA-DNA consistently outperforms generative-only baselines on supervised and zero-shot tasks and yields more biologically grounded representations.",The summary does not break out benchmark-specific results and is specific to genomic sequence modeling.,Apply latent grounding to additional biological-sequence models and more genomic foundation-model pipelines.,abstract-level synthesis
2602.14771,GOT-JEPA: Generic Object Tracking with Model Adaptation and Occlusion Handling using Joint-Embedding Predictive Architecture,arxiv,2026-02-16T14:26:07Z,Shih-Fang Chen; Jun-Cheng Chen; I-Hong Jhuo; Yen-Yu Lin,cs.CV; cs.AI; cs.LG; cs.MM; cs.NE,https://huggingface.co/papers/2602.14771,https://arxiv.org/abs/2602.14771,/root/workspace/jepa/pdfs/2602.14771.pdf,Predicting tracking models rather than only image features can improve generic object tracking generalization and fine-grained occlusion handling.,GOT-JEPA uses a teacher predictor to generate pseudo-tracking models from a clean current frame and trains a student to match them from a corrupted frame given the same history; it is paired with OccuSolver for object-aware visibility estimation and iterative occlusion refinement.,"The framework provides stable pseudo supervision under occlusions, distractors, and adverse observations, while OccuSolver improves visibility labels and occlusion handling; evaluations on seven benchmarks indicate stronger generalization and robustness.",The abstract does not provide headline numerical improvements and focuses specifically on generic object tracking and occlusion reasoning.,Extend predictive tracking-model pretraining and iterative occlusion reasoning to broader tracking conditions and scene dynamics.,abstract-level synthesis
2602.12540,Self-Supervised JEPA-based World Models for LiDAR Occupancy Completion and Forecasting,arxiv,2026-02-13T02:42:21Z,Haoran Zhu; Anna Choromanska,cs.CV; cs.RO,https://huggingface.co/papers/2602.12540,https://arxiv.org/abs/2602.12540,/root/workspace/jepa/pdfs/2602.12540.pdf,A self-supervised JEPA world model can learn useful LiDAR representations for modeling spatiotemporal scene evolution in autonomous driving.,"Introduces AD-LiST-JEPA, a JEPA-based world model trained on unlabeled LiDAR data, and evaluates the learned encoder on LiDAR occupancy completion and forecasting.",Proof-of-concept experiments show that JEPA pretraining improves downstream occupancy completion and forecasting performance.,The summary reports proof-of-concept results centered on the OCF downstream task; broader long-horizon planning validation is not described.,Scale self-supervised LiDAR world-model pretraining and test whether the learned representations improve longer-horizon planning and driving tasks.,abstract-level synthesis
2602.12245,Intrinsic-Energy Joint Embedding Predictive Architectures Induce Quasimetric Spaces,arxiv,2026-02-12T18:30:27Z,Anthony Kobanda; Waris Radji,cs.LG; cs.AI,https://huggingface.co/papers/2602.12245,https://arxiv.org/abs/2602.12245,/root/workspace/jepa/pdfs/2602.12245.pdf,"Intrinsic JEPA energy functions form quasimetrics, linking JEPA representation learning with quasimetric reinforcement learning and asymmetric goal-reaching dynamics.","Presents a theoretical analysis of intrinsic least-action JEPA energies under closure and additivity assumptions, and compares them with goal-reaching cost-to-go functions.","Shows that any intrinsic energy is a quasimetric, that optimal cost-to-go functions admit this intrinsic form, and that symmetric finite energies mismatch one-way reachability.",This is a short theoretical article; the summary does not describe empirical validation beyond the conceptual connection.,Use asymmetric intrinsic-energy JEPA objectives in goal-conditioned control and reinforcement-learning settings where directionality matters.,abstract-level synthesis
2602.11832,JEPA-VLA: Video Predictive Embedding is Needed for VLA Models,arxiv,2026-02-12T11:20:43Z,Shangchen Miao; Ningya Feng; Jialong Wu; Ye Lin; Xu He; Dong Li; Mingsheng Long,cs.CV; cs.RO,https://huggingface.co/papers/2602.11832,https://arxiv.org/abs/2602.11832,/root/workspace/jepa/pdfs/2602.11832.pdf,"Video-predictive embeddings, especially V-JEPA 2, address key weaknesses in existing visual representations for vision-language-action models.","Analyzes shortcomings of current VLA visual representations, then introduces JEPA-VLA to adaptively integrate predictive video embeddings into existing VLAs and evaluates it on simulation and real-robot benchmarks.","Predictive embeddings better capture task-relevant temporal dynamics and JEPA-VLA delivers substantial gains on LIBERO, LIBERO-plus, RoboTwin2.0, and real-robot tasks.","The summary emphasizes benchmark gains but does not detail compute trade-offs, failure modes, or settings where predictive embeddings may be less helpful.",Integrate video-predictive pretraining more broadly into robotic policy learning to improve sample efficiency and generalization.,abstract-level synthesis
2602.11389,Causal-JEPA: Learning World Models through Object-Level Latent Interventions,huggingface_papers;arxiv,2026-02-11T21:47:26Z,Heejeong Nam; Quentin Le Lidec; Lucas Maes; Yann LeCun; Randall Balestriero,cs.AI,https://huggingface.co/papers/2602.11389,https://arxiv.org/abs/2602.11389,/root/workspace/jepa/pdfs/2602.11389.pdf,Object-level masking in JEPA-style world models induces a causal inductive bias that improves interaction reasoning and planning efficiency.,"Proposes C-JEPA, which extends masked joint embedding prediction from patches to object-centric representations using object-level masking, and evaluates it on visual question answering and control tasks alongside a formal analysis.","C-JEPA improves counterfactual reasoning by about 20% absolutely, reaches comparable control with only 1% of the latent input features of patch-based models, and is supported by a formal causal analysis.","The approach depends on object-centric representations, and the summary only reports results on the listed VQA and control settings.","Apply object-level latent interventions to broader world-model, reasoning, and control problems where interactions matter.",abstract-level synthesis
2602.10098,VLA-JEPA: Enhancing Vision-Language-Action Model with Latent World Model,huggingface_papers;arxiv,2026-02-10T18:58:01Z,Jingwen Sun; Wenyao Zhang; Zekun Qi; Shaojie Ren; Zezhi Liu; Hanxin Zhu; Guangzhong Sun; Xin Jin; Zhibo Chen,cs.RO; cs.CV,https://huggingface.co/papers/2602.10098,https://arxiv.org/abs/2602.10098,/root/workspace/jepa/pdfs/2602.10098.pdf,Leakage-free latent prediction lets VLA pretraining focus on action-relevant state transitions rather than pixel variation or nuisance motion.,"Introduces VLA-JEPA, where a target encoder provides latent targets from future frames while the student sees only the current observation, followed by action-head fine-tuning.","Across LIBERO, LIBERO-Plus, SimplerEnv, and real-world manipulation tasks, VLA-JEPA improves robustness and generalization over prior methods.","The summary highlights benchmark gains but does not describe detailed ablations, limitations, or behavior outside the reported manipulation settings.",Extend leakage-free JEPA pretraining to broader robotic policies and internet-scale video learning pipelines.,abstract-level synthesis
