paper_id,title,source,published,authors,categories,hf_papers_url,arxiv_url,local_pdf,principal_argument,methodology,main_findings,limitations_or_gaps,future_opportunities,notes
2509.06831,Leveraging Generic Foundation Models for Multimodal Surgical Data Analysis,huggingface_papers;arxiv,2025-09-08T16:04:19Z,Simon Pezold; Jérôme A. Kurylec; Jan S. Liechti; Beat P. Müller; Joël L. Lavanchy,cs.CV,https://huggingface.co/papers/2509.06831,https://arxiv.org/abs/2509.06831,/root/workspace/jepa/pdfs/2509.06831.pdf,Generic video foundation models become more useful for surgical data science when adapted with unlabeled domain video and paired with complementary operating-room data streams.,"Uses V-JEPA as the video foundation of a multimodal model, tests pretrained and domain-finetuned variants, and adds separate encoders for additional time-resolved OR modalities across surgery prediction and phase-recognition tasks.","Domain-specific finetuning improves performance, multimodal integration helps on the in-house liver surgery data, and the pretrained video-only baseline is already competitive on HeiCo surgical phase recognition.","Results are tied to the described liver surgery and HeiCo settings, and the summary does not specify how well the approach transfers across procedures, hospitals, or modality configurations.",Broaden evaluation across surgical workflows and explore which additional OR streams are most complementary to adapted V-JEPA embeddings.,abstract-level synthesis
2508.10489,Learning State-Space Models of Dynamic Systems from Arbitrary Data using Joint Embedding Predictive Architectures,arxiv,2025-08-14T09:46:11Z,Jonas Ulmen; Ganesh Sundaram; Daniel Görges,cs.LG,https://huggingface.co/papers/2508.10489,https://arxiv.org/abs/2508.10489,/root/workspace/jepa/pdfs/2508.10489.pdf,JEPA-style representation learning combined with continuous-time dynamics can recover structured latent state-space models from arbitrary observations.,Combines sequence embeddings with neural ODEs and uses losses enforcing contractive embeddings and Lipschitz-constrained state transitions; demonstrates the approach on a simple pendulum from image observations.,"The method is reported to generate structured latent state-space models for a pendulum using only image data, showing promise for world modeling from arbitrary observations.","Evidence in the abstract is limited to a simple pendulum example, with no detail on more complex systems, robustness, or downstream control performance.",The abstract points to more general control and estimation methods in robotics built on these learned latent dynamics.,abstract-level synthesis
2508.02829,Elucidating the Role of Feature Normalization in IJEPA,arxiv,2025-08-04T18:52:17Z,Adam Colton,cs.CV,https://huggingface.co/papers/2508.02829,https://arxiv.org/abs/2508.02829,/root/workspace/jepa/pdfs/2508.02829.pdf,"Layer normalization at the IJEPA teacher output harms useful token-energy structure, and replacing it with DynTanh improves representation learning.","Analyzes the effect of teacher-side feature normalization in IJEPA, replaces layer normalization with DynTanh, inspects loss-map behavior, and evaluates on ImageNet linear probing and NYU Depth V2 depth estimation.","Feature layer normalization is associated with checkerboard artifacts and flattened token energies, while DynTanh preserves longer-tailed loss behavior and improves both ImageNet probe accuracy and depth RMSE.","The summary focuses on IJEPA and two reported downstream evaluations, so broader architectural applicability and sensitivity to other settings are not detailed.",Test energy-preserving target transformations in other JEPA-style models and study when token-energy structure matters most for downstream tasks.,abstract-level synthesis
2507.20491,"Speaking in Words, Thinking in Logic: A Dual-Process Framework in QA Systems",huggingface_papers;arxiv,2025-07-28T03:00:35Z,Tuan Bui; Trong Le; Phat Thai; Sang Nguyen; Minh Hua; Ngan Pham; Thang Bui; Tho Quan,cs.CL; cs.AI; cs.SC,https://huggingface.co/papers/2507.20491,https://arxiv.org/abs/2507.20491,/root/workspace/jepa/pdfs/2507.20491.pdf,A lightweight Text-JEPA plus symbolic solver pipeline can provide more efficient and interpretable closed-domain QA than relying only on large LLM-based systems.,"Introduces Text-JEPA for natural-language-to-first-order-logic conversion, couples it with the Z3 solver for reasoning, and evaluates the pipeline with custom conversion, reasoning, and rank-correlation metrics on domain-specific datasets.",The framework achieves competitive performance with lower computational overhead and supports transparent reasoning through structured logic representations.,"The summary emphasizes closed-domain datasets and custom metrics, and does not establish behavior for open-domain QA or more diverse reasoning settings.",Apply the dual-process design to more specialized domains and refine logic-conversion methods that preserve reasoning quality at low computational cost.,abstract-level synthesis
2507.19956,Predicting Brain Responses To Natural Movies With Multimodal LLMs,arxiv,2025-07-26T13:57:08Z,Cesar Kadir Torrico Villanueva; Jiaxin Cindy Tu; Mihir Tripathy; Connor Lane; Rishab Iyer; Paul S. Scotti,cs.CV; cs.AI; q-bio.NC,https://huggingface.co/papers/2507.19956,https://arxiv.org/abs/2507.19956,/root/workspace/jepa/pdfs/2507.19956.pdf,Ensembling temporally aligned multimodal foundation-model features can improve prediction of brain responses to natural movie stimuli.,"Extracts representations from video, speech, text, vision-text, and vision-text-audio models, aligns them to fMRI time series, maps them with a lightweight shared-plus-subject-specific encoder, and ensembles many tuned variants for the Algonauts 2025 challenge.","The final system reached a mean Pearson correlation of 0.2085 on withheld out-of-distribution movies, ranking fourth, and the authors report a last-minute optimization that could have placed second.","This is a challenge-oriented pipeline summary, and it does not disentangle the contribution of each modality or assess performance beyond the described competition setup.",Study modality-specific contributions and further optimize multimodal ensembles for out-of-distribution neural encoding of movie stimuli.,abstract-level synthesis
2507.18424,Self-Supervised Ultrasound-Video Segmentation with Feature Prediction and 3D Localised Loss,arxiv,2025-07-24T14:01:02Z,Edward Ellis; Robert Mendel; Andrew Bulpitt; Nasim Parsa; Michael F Byrne; Sharib Ali,cs.CV,https://huggingface.co/papers/2507.18424,https://arxiv.org/abs/2507.18424,/root/workspace/jepa/pdfs/2507.18424.pdf,"V-JEPA is a promising self-supervised pretraining framework for ultrasound video, and adding a 3D localisation auxiliary task improves downstream segmentation.","Adapts V-JEPA to ultrasound video data, adds a 3D localisation auxiliary objective to strengthen locality in ViT representations, and evaluates frozen-encoder segmentation under varying label availability.","The proposed auxiliary task improves segmentation performance across frozen encoder setups, with gains reported both at full data and at 10 percent of the training data.","The summary frames the work around ultrasound video segmentation and frozen-encoder experiments, without evidence here about other imaging modalities or model families.",Extend JEPA-style ultrasound pretraining to additional medical video tasks and study whether locality-focused auxiliary losses help in other low-data clinical settings.,abstract-level synthesis
2507.17958,VIBE: Video-Input Brain Encoder for fMRI Response Modeling,huggingface_papers;arxiv,2025-07-23T22:02:56Z,Daniel Carlström Schad; Shrey Dixit; Janis Keck; Viktor Studenyak; Aleksandr Shpilevoi; Andrej Bicanski,cs.LG; cs.AI; cs.CV,https://huggingface.co/papers/2507.17958,https://arxiv.org/abs/2507.17958,/root/workspace/jepa/pdfs/2507.17958.pdf,Fusing multimodal movie features with a two-stage transformer can improve fMRI response modeling for both in-distribution and out-of-distribution stimuli.,"Builds a modality-fusion transformer and a temporally decoding prediction transformer over video, audio, and text features from open-source models, trained on 65 hours of CNeuroMod movie data and ensembled across 20 seeds.","VIBE attains mean parcel-wise Pearson correlations of 0.3225 in-distribution and 0.2125 out-of-distribution, and an earlier version won Phase-1 and placed second overall in the Algonauts 2025 challenge.",The summary reports aggregate challenge-style metrics but does not isolate which modalities or architectural pieces are most responsible for performance.,"Probe modality importance, simplify the ensemble-heavy setup, and test the architecture on broader neural response prediction datasets.",abstract-level synthesis
2507.15216,Improving Joint Embedding Predictive Architecture with Diffusion Noise,huggingface_papers;arxiv,2025-07-21T03:36:58Z,Yuping Qiu; Rui Zhu; Ying-cong Chen,cs.CV,https://huggingface.co/papers/2507.15216,https://arxiv.org/abs/2507.15216,/root/workspace/jepa/pdfs/2507.15216.pdf,Injecting diffusion noise into JEPA-style masked image modeling can strengthen self-supervised visual representation learning.,"Proposes N-JEPA, which incorporates diffusion noise through masked-token position embeddings and adds a multi-level noise schedule as a feature-augmentation strategy.",A comprehensive downstream classification study is said to confirm the effectiveness of the method and the robustness benefits of the noise schedule.,"The abstract focuses on recognition performance and does not report detailed benchmark outcomes, generative behavior, or failure modes.","The work suggests deeper exploration of the connection between diffusion-style corruption and self-supervised recognition models, alongside public code release.",abstract-level synthesis
2507.03633,From Video to EEG: Adapting Joint Embedding Predictive Architecture to Uncover Saptiotemporal Dynamics in Brain Signal Analysis,huggingface_papers;arxiv,2025-07-04T15:01:34Z,Amirabbas Hojjati; Lu Li; Ibrahim Hameed; Anis Yazidi; Pedro G. Lind; Rabindra Khadka,cs.CV; cs.AI; cs.LG,https://huggingface.co/papers/2507.03633,https://arxiv.org/abs/2507.03633,/root/workspace/jepa/pdfs/2507.03633.pdf,Treating EEG as video-like sequences allows V-JEPA to learn scalable and interpretable spatiotemporal EEG representations for classification.,"Adapts V-JEPA to EEG classification with joint embeddings and adaptive masking, and evaluates the model on the TUH Abnormal EEG dataset while examining learned signal patterns.",EEG-VJEPA reportedly outperforms existing state-of-the-art EEG classifiers and captures physiologically relevant spatial and temporal patterns that support interpretability.,"The abstract highlights results on one public dataset and does not describe performance across broader EEG tasks, sites, or deployment conditions.","The paper positions EEG-VJEPA as a candidate framework for scalable, trustworthy EEG analysis and human-AI support in diagnostic workflows.",abstract-level synthesis
2507.01080,"Development and Comparative Evaluation of Three Artificial Intelligence Models (NLP, LLM, JEPA) for Predicting Triage in Emergency Departments: A 7-Month Retrospective Proof-of-Concept",arxiv,2025-07-01T16:37:55Z,Edouard Lansiaux; Ramy Azzouz; Emmanuel Chazard; Amélie Vromant; Eric Wiel,cs.LG; cs.PF,https://huggingface.co/papers/2507.01080,https://arxiv.org/abs/2507.01080,/root/workspace/jepa/pdfs/2507.01080.pdf,A comparative triage study suggests LLM-based modeling is more effective than the tested NLP and JEPA alternatives for emergency-department triage prediction.,"Evaluates three AI systems against the FRENCH triage scale and nurse practice using seven months of adult triage data from Roger Salengro Hospital in Lille, France.","The LLM-based URGENTIAPARSE achieved the best reported accuracy, AUC-ROC, and hospitalization-prediction performance, outperforming both the NLP and JEPA models as well as nurse triage.","This is a seven-month retrospective proof-of-concept at a single hospital, and the abstract notes that adoption still depends on addressing limitations and ethical transparency.",The summary points toward ethically transparent integration of LLM-based support tools into emergency-department workflows.,abstract-level synthesis
2506.20795,How do Foundation Models Compare to Skeleton-Based Approaches for Gesture Recognition in Human-Robot Interaction?,arxiv,2025-06-25T19:36:45Z,Stephanie Käs; Anton Burenko; Louis Markert; Onur Alp Culha; Dennis Mack; Timm Linder; Bastian Leibe,cs.CV; cs.HC; cs.RO,https://huggingface.co/papers/2506.20795,https://arxiv.org/abs/2506.20795,/root/workspace/jepa/pdfs/2506.20795.pdf,"General-purpose foundation models can approach strong gesture-recognition performance, but skeleton-based methods still lead on the studied human-robot interaction task.","Compares V-JEPA, Gemini Flash 2.0, and the skeleton-based HD-GCN on NUGGET, a gesture dataset designed for intralogistics human-robot communication.","HD-GCN performs best, V-JEPA comes close when equipped with a simple task-specific head, and Gemini underperforms in zero-shot gesture recognition from textual descriptions alone.","The comparison is tied to the NUGGET dataset and the tested models, and the summary indicates zero-shot text-only prompting is insufficient for fine gesture discrimination.",Explore shared multi-task systems built on V-JEPA and develop better input representations for gesture understanding in multimodal foundation models.,abstract-level synthesis
2507.02915,Audio-JEPA: Joint-Embedding Predictive Architecture for Audio Representation Learning,huggingface_papers;arxiv,2025-06-25T08:38:27Z,Ludovic Tuncay; Etienne Labbé; Emmanouil Benetos; Thomas Pellegrini,cs.SD; cs.AI; cs.LG; eess.AS; eess.SP,https://huggingface.co/papers/2507.02915,https://arxiv.org/abs/2507.02915,/root/workspace/jepa/pdfs/2507.02915.pdf,A straightforward JEPA adaptation to audio can learn competitive audio representations without reconstructing raw waveforms.,"Uses a Vision Transformer to predict masked mel-spectrogram patch representations, pretrains on unlabeled AudioSet clips, and evaluates on the X-ARES speech, music, and environmental sound suite.","Despite being a simple translation of the original model and using no hyper-parameter tuning, Audio-JEPA is reported to perform comparably to wav2vec 2.0 and data2vec with less than one-fifth of their training data.","The abstract presents an intentionally simple adaptation and does not detail scaling behavior, domain-specific weaknesses, or stronger audio-specialized variants.","Release code and checkpoints and build more audio-specific JEPA variants for speech, music, and environmental sound tasks.",abstract-level synthesis
2506.18220,Cross-Architecture Knowledge Distillation (KD) for Retinal Fundus Image Anomaly Detection on NVIDIA Jetson Nano,arxiv,2025-06-23T00:57:43Z,Berk Yilmaz; Aniruddh Aiyengar,cs.CV; cs.AI; cs.LG,https://huggingface.co/papers/2506.18220,https://arxiv.org/abs/2506.18220,/root/workspace/jepa/pdfs/2506.18220.pdf,Cross-architecture knowledge distillation can compress an I-JEPA-pretrained ViT fundus classifier into an edge-deployable CNN while retaining much of its diagnostic behavior.,"Trains an I-JEPA-pretrained ViT teacher for four-class retinal classification, distills it into a CNN student using partitioned cross-attention and group-wise linear projectors plus multi-view robust training, and targets deployment on Jetson Nano.",The student is far smaller than the teacher yet achieves 89 percent classification accuracy and retains roughly 93 percent of the teacher performance according to the summary.,The paper summary focuses on one retinal imaging classification setup and does not report broader clinical validation or deployment behavior outside the stated edge-device context.,"Validate the distillation framework on additional ophthalmic and low-resource medical imaging tasks, and assess real-world edge deployment constraints more fully.",abstract-level synthesis
2506.18194,Joint Embedding Predictive Architecture for self-supervised pretraining on polymer molecular graphs,arxiv,2025-06-22T22:51:53Z,Francesco Piccoli; Gabriel Vogel; Jana M. Weber,cs.LG,https://huggingface.co/papers/2506.18194,https://arxiv.org/abs/2506.18194,/root/workspace/jepa/pdfs/2506.18194.pdf,JEPA-based self-supervised pretraining can improve polymer graph learning when high-quality labels are scarce.,Applies JEPA self-supervised pretraining to polymer molecular graphs and compares downstream property-prediction performance across multiple datasets under limited-label conditions.,"The abstract reports downstream improvements across all tested datasets, with especially strong benefits when labeled data is very scarce.","The summary does not describe architecture choices, pretraining cost, or whether the gains persist when more labeled data is available.",The work supports further use of JEPA-style graph pretraining for polymer discovery and other low-label materials-learning settings.,abstract-level synthesis
2506.16216,From Pixels to CSI: Distilling Latent Dynamics For Efficient Wireless Resource Management,arxiv,2025-06-19T11:08:20Z,Charbel Bou Chaaya; Abanoub M. Girgis; Mehdi Bennis,cs.LG,https://huggingface.co/papers/2506.16216,https://arxiv.org/abs/2506.16216,/root/workspace/jepa/pdfs/2506.16216.pdf,"Coupled JEPAs can jointly model control dynamics and wireless channel dynamics, enabling more efficient wireless resource management without degrading control performance.","Uses a control JEPA and a wireless JEPA with cross-modal conditioning, then trains deep reinforcement learning for control and a power predictor for favorable scheduling based on latent CSI representations.","In synthetic multimodal simulations, the approach reduces transmit power by more than 50 percent while maintaining control performance comparable to baselines that ignore wireless optimization.","The evidence described in the summary is simulation-based and synthetic, so real-world wireless-control deployment performance remains unverified there.",Test the coupled-JEPA strategy on real communication-control systems and examine broader multimodal resource-management settings beyond the synthetic setup.,abstract-level synthesis
2507.00028,HiT-JEPA: A Hierarchical Self-supervised Trajectory Embedding Framework for Similarity Computation,arxiv,2025-06-17T11:46:03Z,Lihuan Li; Hao Xue; Shuang Ao; Yang Song; Flora Salim,cs.LG; cs.AI; cs.CV,https://huggingface.co/papers/2507.00028,https://arxiv.org/abs/2507.00028,/root/workspace/jepa/pdfs/2507.00028.pdf,Hierarchical JEPA representations can jointly capture fine-grained and high-level trajectory semantics for better similarity computation.,"Introduces a three-layer hierarchy that learns point-level, intermediate, and high-level urban trajectory representations within one joint-embedding predictive framework.",Experiments on multiple real-world datasets are reported to yield richer multi-scale representations and improved trajectory similarity computation.,The abstract is centered on similarity tasks and does not discuss other trajectory analytics uses or the computational trade-offs of the hierarchical design.,The framework could be extended to broader urban trajectory analysis settings that benefit from multi-scale movement representations.,abstract-level synthesis
2506.09985,"V-JEPA 2: Self-Supervised Video Models Enable Understanding, Prediction and Planning",huggingface_papers;arxiv,2025-06-11T17:57:09Z,Mido Assran; Adrien Bardes; David Fan; Quentin Garrido; Russell Howes; Mojtaba; Komeili; Matthew Muckley; Ammar Rizvi; Claire Roberts; Koustuv Sinha; Artem Zholus; Sergio Arnaud; Abha Gejji; Ada Martin; Francois Robert Hogan; Daniel Dugas; Piotr Bojanowski; Vasil Khalidov; Patrick Labatut; Francisco Massa; Marc Szafraniec; Kapil Krishnakumar; Yong Li; Xiaodong Ma; Sarath Chandar; Franziska Meier; Yann LeCun; Michael Rabbat; Nicolas Ballas,cs.AI; cs.CV; cs.LG; cs.RO,https://huggingface.co/papers/2506.09985,https://arxiv.org/abs/2506.09985,/root/workspace/jepa/pdfs/2506.09985.pdf,"Large-scale self-supervised video JEPA models can support world understanding, anticipation, question answering, and robotic planning from mostly observational data.","Pretrains V-JEPA 2 on over 1 million hours of internet video and images, aligns it with a large language model for video question answering, and post-trains an action-conditioned variant with limited robot data for planning.","The abstract reports strong motion-understanding results, state-of-the-art human action anticipation and several video-QA scores, plus zero-shot pick-and-place planning on Franka arms in two labs.","The abstract does not detail compute demands, failure modes, or broader robotics generalization, and the planning setup still relies on post-training with robot data.",The work opens opportunities for self-supervised world models that connect web-scale video learning to physical-world planning and control.,abstract-level synthesis
2506.14782,Integrating Dynamical Systems Learning with Foundational Models: A Meta-Evolutionary AI Framework for Clinical Trials,arxiv,2025-05-25T03:34:33Z,Joseph Geraci; Bessi Qorri; Christian Cumbaa; Mike Tsay; Paul Leonczyk; Luca Pani,cs.LG; q-bio.QM,https://huggingface.co/papers/2506.14782,https://arxiv.org/abs/2506.14782,/root/workspace/jepa/pdfs/2506.14782.pdf,"A meta-evolutionary framework that combines a small-data, interpretable dynamical-systems model with an LLM strategist can improve clinical-trial subgroup discovery and prediction.","Formalizes NetraAI with contraction mappings, information geometry, evolutionary search, pseudo-temporal embeddings, and long-range memory, then uses an LLM layer to prioritize variables, inject domain knowledge, and assess robustness in case studies.","Across schizophrenia, depression, and pancreatic cancer case studies, the framework identifies small high-effect subpopulations and reportedly lifts weak baseline models to near-perfect classifiers using few features.","The summary presents case studies rather than broad benchmark evidence, and its link to JEPA is conceptual alignment rather than a direct JEPA-based method.","Assess the framework on more clinical datasets and further study how meta-level LLM guidance can support reliable, explainable cohort discovery.",abstract-level synthesis
2505.14543,Time to Embed: Unlocking Foundation Models for Time Series with Channel Descriptions,arxiv,2025-05-20T15:58:54Z,Utsav Dutta; Sina Khoshfetrat Pakazad; Henrik Ohlsson,cs.LG,https://huggingface.co/papers/2505.14543,https://arxiv.org/abs/2505.14543,/root/workspace/jepa/pdfs/2505.14543.pdf,Time-series foundation models can benefit from JEPA training and channel-description conditioning to learn transferable multivariate embeddings.,"Introduces CHARM, a 7M-parameter multivariate time-series embedding model that incorporates channel-level textual descriptions, is invariant to channel order, and is trained with JEPA plus tailored augmentations and loss design.","The summary reports state-of-the-art performance across diverse downstream tasks and positions CHARM as a domain-aware, transferable foundation embedding model for time series.","The abstract-level description does not specify which downstream tasks or datasets drive the gains, nor where the model may fail.",Expand JEPA-based time-series foundation learning to more domains and investigate how textual channel descriptions shape transfer and interpretability.,abstract-level synthesis
2505.03176,seq-JEPA: Autoregressive Predictive Learning of Invariant-Equivariant World Models,huggingface_papers;arxiv,2025-05-06T04:39:11Z,Hafez Ghaemi; Eilif Muller; Shahab Bakhtiari,cs.CV; cs.AI; cs.LG,https://huggingface.co/papers/2505.03176,https://arxiv.org/abs/2505.03176,/root/workspace/jepa/pdfs/2505.03176.pdf,Sequential JEPA world modeling can learn invariant and equivariant representations together without the usual trade-off between them.,"Processes short sequences of transformed views, combines each with a relative transformation embedding, aggregates them with a transformer, and predicts the next representation conditioned on the upcoming action.",seq-JEPA is reported to perform strongly on both invariance- and equivariance-oriented tasks and to excel on sequence-based problems such as path integration and predictive learning across eye movements.,"The abstract does not quantify compute or data trade-offs, and the evidence described is limited to the reported downstream tasks.","The approach suggests richer sequential world models for predictive learning, navigation-like problems, and other action-conditioned perception tasks.",abstract-level synthesis
2504.16591,JEPA for RL: Investigating Joint-Embedding Predictive Architectures for Reinforcement Learning,arxiv,2025-04-23T10:16:12Z,Tristan Kenneweg; Philip Kenneweg; Barbara Hammer,cs.CV,https://huggingface.co/papers/2504.16591,https://arxiv.org/abs/2504.16591,/root/workspace/jepa/pdfs/2504.16591.pdf,JEPA can be adapted from self-supervised vision to reinforcement learning from images if model collapse is understood and mitigated.,"Adapts JEPA to image-based reinforcement learning, studies model collapse and prevention strategies, and provides an initial demonstration on the Cart Pole task.",The paper offers early evidence on classical Cart Pole and emphasizes practical handling of collapse in this RL setting.,"The abstract mentions only exemplary results on Cart Pole, so performance on harder RL environments and broader benchmarks is left unclear.",A natural next step is evaluating JEPA-based RL on more complex image-based control tasks beyond the initial Cart Pole study.,abstract-level synthesis
