paper_id,title,source,published,authors,categories,hf_papers_url,arxiv_url,local_pdf,principal_argument,methodology,main_findings,limitations_or_gaps,future_opportunities,notes
2602.09985,Online Monitoring Framework for Automotive Time Series Data using JEPA Embeddings,arxiv,2026-02-10T17:10:29Z,Alexander Fertig; Karthikeyan Chandra Sekaran; Lakshman Balasubramanian; Michael Botsch,cs.LG; cs.AI; cs.CV,https://huggingface.co/papers/2602.09985,https://arxiv.org/abs/2602.09985,/root/workspace/jepa/pdfs/2602.09985.pdf,JEPA-based self-supervised embeddings can support online anomaly monitoring for automotive time-series data without anomaly labels.,"Builds a JEPA-based self-supervised prediction task to learn object-state embeddings, then applies established anomaly-detection methods to those embeddings and evaluates on nuScenes.",The learned JEPA embeddings provide expressive latent representations that enable anomaly identification in real-world automotive data.,"The summary focuses on object-state monitoring and nuScenes-based experiments, without describing broader deployment results or labeled anomaly comparisons.",Deploy the framework in live vehicle monitoring pipelines and test it on a wider range of unknown anomaly types and operational conditions.,abstract-level synthesis
2603.00049,BiJEPA: Bi-directional Joint Embedding Predictive Architecture for Symmetric Representation Learning,arxiv,2026-02-10T01:16:20Z,Yongchao Huang,cs.LG,https://huggingface.co/papers/2603.00049,https://arxiv.org/abs/2603.00049,/root/workspace/jepa/pdfs/2603.00049.pdf,Bi-directional JEPA with cycle consistency can learn more symmetric representations than standard uni-directional JEPA when stabilized appropriately.,"Proposes BiJEPA with bi-directional prediction and a critical norm regularization mechanism, then evaluates it on synthetic periodic signals, Lorenz attractors, and MNIST.","BiJEPA converges stably without collapse, captures semantic structure in chaotic systems, and learns robust representations that support generation and generalisation.","The reported evaluation is limited to synthetic and benchmark datasets in the summary, rather than larger real-world applications.",Test bidirectional predictive objectives on more complex modalities and larger-scale representation-learning problems.,abstract-level synthesis
2602.04643,MTS-JEPA: Multi-Resolution Joint-Embedding Predictive Architecture for Time-Series Anomaly Prediction,arxiv,2026-02-04T15:11:29Z,Yanan He; Yunshi Wen; Xin Wang; Tengfei Ma,cs.LG,https://huggingface.co/papers/2602.04643,https://arxiv.org/abs/2602.04643,/root/workspace/jepa/pdfs/2602.04643.pdf,A multi-resolution JEPA with a soft codebook bottleneck can capture anomaly precursors across time scales while avoiding collapse.,"Introduces MTS-JEPA, combining a multi-resolution predictive objective with a soft codebook bottleneck that separates transient shocks, long-term trends, and regime transitions.",The proposed design prevents degenerate solutions and achieves state-of-the-art results under the early-warning protocol on standard benchmarks.,The summary reports benchmark performance but does not discuss deployment constraints or behavior beyond the evaluated early-warning setting.,Apply multi-resolution JEPA anomaly prediction to critical infrastructure monitoring and other multivariate time-series domains.,abstract-level synthesis
2602.03604,A Lightweight Library for Energy-Based Joint-Embedding Predictive Architectures,huggingface_papers;arxiv,2026-02-03T14:56:24Z,Basile Terver; Randall Balestriero; Megi Dervishi; David Fan; Quentin Garrido; Tushar Nagarajan; Koustuv Sinha; Wancong Zhang; Mike Rabbat; Yann LeCun; Amir Bar,cs.CV; cs.AI,https://huggingface.co/papers/2602.03604,https://arxiv.org/abs/2602.03604,/root/workspace/jepa/pdfs/2602.03604.pdf,"A lightweight, modular library can make energy-based JEPA methods accessible across image, video, and action-conditioned world-model settings.","Presents the EB-JEPA open-source library with single-GPU examples, plus ablations on CIFAR-10, a Moving MNIST video example, and an action-conditioned Two Rooms world-model task.","The library demonstrates 91% probing accuracy on CIFAR-10, scalable multi-step video prediction, 97% planning success on Two Rooms, and the importance of regularization for avoiding collapse.",The summary emphasizes lightweight examples and educational accessibility rather than broad production-scale benchmarks.,"Use the library as a base for research, teaching, and more extensive experiments on JEPA representation learning and world models.",abstract-level synthesis
2602.02093,Cell-JEPA: Latent Representation Learning for Single-Cell Transcriptomics,arxiv,2026-02-02T13:38:04Z,Ali ElSheikh; Rui-Xi Wang; Weimin Wu; Yibo Wen; Payam Dibaeinia; Jennifer Yuntong Zhang; Jerry Yao-Chieh Hu; Mei Knudson; Sudarshan Babu; Shao-Hua Sun; Aly A. Khan; Han Liu,cs.CE,https://huggingface.co/papers/2602.02093,https://arxiv.org/abs/2602.02093,/root/workspace/jepa/pdfs/2602.02093.pdf,Predicting latent cell embeddings from partial observations can learn dropout-robust single-cell representations better than masked count reconstruction.,"Introduces Cell-JEPA, which predicts cell-level embeddings from partial gene observations, and evaluates zero-shot cell-type clustering and perturbation prediction.","Cell-JEPA improves zero-shot transfer clustering over scGPT and improves absolute-state reconstruction in perturbation prediction, though not effect-size estimation.","The summary explicitly notes that effect-size estimation does not improve, indicating incomplete gains for perturbation modeling.",Combine JEPA-based representation learning with stronger perturbation-modeling methods for more complete cellular prediction.,abstract-level synthesis
2602.01456,Rectified LpJEPA: Joint-Embedding Predictive Architectures with Sparse and Maximum-Entropy Representations,huggingface_papers;arxiv,2026-02-01T21:49:30Z,Yilun Kuang; Yash Dagade; Tim G. J. Rudner; Randall Balestriero; Yann LeCun,cs.LG; cs.CV,https://huggingface.co/papers/2602.01456,https://arxiv.org/abs/2602.01456,/root/workspace/jepa/pdfs/2602.01456.pdf,"JEPA regularization should support sparse, non-negative, maximum-entropy representations rather than only dense Gaussian-like ones.","Introduces Rectified Distribution Matching Regularization to align representations with a Rectified Generalized Gaussian distribution, yielding Rectified LpJEPA.","Rectified LpJEPA learns sparse, non-negative representations with strong sparsity-performance trade-offs and competitive image-classification performance.","The summary focuses on image-classification benchmarks, so broader modality coverage or downstream impacts are not described.",Explore sparsity-controlled JEPA objectives in additional tasks and modalities where efficient representations may matter.,abstract-level synthesis
2601.22032,Drive-JEPA: Video JEPA Meets Multimodal Trajectory Distillation for End-to-End Driving,huggingface_papers;arxiv,2026-01-29T17:39:20Z,Linhan Wang; Zichong Yang; Chen Bai; Guoxiang Zhang; Xiaotong Liu; Xiaoyin Zheng; Xiao-Xiao Long; Chang-Tien Lu; Cheng Lu,cs.CV,https://huggingface.co/papers/2601.22032,https://arxiv.org/abs/2601.22032,/root/workspace/jepa/pdfs/2601.22032.pdf,Combining V-JEPA pretraining with multimodal trajectory distillation can better align end-to-end driving representations with planning and behavioral ambiguity.,"Adapts V-JEPA to large-scale driving videos, then adds a proposal-centric planner that distills simulator-generated and human trajectories with momentum-aware selection.","On NAVSIM, the V-JEPA representation plus a simple decoder beats prior work in the perception-free setting, and the full Drive-JEPA system sets a new state of the art.","The summary reports benchmark results on NAVSIM, but does not discuss broader real-world deployment or other driving benchmarks.",Extend predictive video pretraining and multimodal trajectory distillation to broader autonomous-driving planning systems.,abstract-level synthesis
2602.07000,Hierarchical JEPA Meets Predictive Remote Control in Beyond 5G Networks,arxiv,2026-01-28T17:04:06Z,Abanoub M. Girgis; Ibtissam Labriji; Mehdi Bennis,eess.SY; cs.AI; cs.RO,https://huggingface.co/papers/2602.07000,https://arxiv.org/abs/2602.07000,/root/workspace/jepa/pdfs/2602.07000.pdf,Hierarchical JEPA can improve scalable predictive remote control by operating directly in compact embedding space under bandwidth limits.,"Proposes a three-level hierarchical predictor over low-dimensional embeddings for different temporal resolutions, with control actions derived in latent space rather than reconstructed state space.","In inverted cart-pole simulations, H-JEPA supports up to 42.83% more devices under limited wireless capacity without sacrificing control performance.","The summary only reports simulation results on inverted cart-pole systems, leaving broader system validation open.",Evaluate hierarchical JEPA control in more complex wireless networked control scenarios and with richer device observations.,abstract-level synthesis
2601.19822,A Latent Space Framework for Modeling Transient Engine Emissions Using Joint Embedding Predictive Architectures,arxiv,2026-01-27T17:29:05Z,Ganesh Sundaram; Tobias Gehra; Jonas Ulmen; Mirjan Heubaum; Daniel Görges; Michael Günthner,eess.SY,https://huggingface.co/papers/2601.19822,https://arxiv.org/abs/2601.19822,/root/workspace/jepa/pdfs/2601.19822.pdf,A structured JEPA latent space can model transient engine emissions more accurately and efficiently than monolithic neural baselines.,"Learns emission dynamics from combined PEMS and high-frequency hardware-in-the-loop data using a JEPA framework, then supports pruning and post-training quantization for deployment.","The approach outperforms strong LSTM baselines in data efficiency, predictive accuracy, and generalization, while quantization and pruning greatly reduce footprint with negligible loss.",The summary is specific to transient engine-emission modeling and does not describe results beyond the reported datasets and regimes.,"Use the efficient JEPA model for onboard emission control, model predictive control, or model-based reinforcement learning in future powertrains.",abstract-level synthesis
2601.15891,RadJEPA: Radiology Encoder for Chest X-Rays via Joint Embedding Predictive Architecture,huggingface_papers;arxiv,2026-01-22T12:11:53Z,Anas Anwarul Haq Khan; Mariam Husain; Kshitij Jadhav,cs.CV,https://huggingface.co/papers/2601.15891,https://arxiv.org/abs/2601.15891,/root/workspace/jepa/pdfs/2601.15891.pdf,Robust radiology image encoders can be learned from unlabeled chest X-rays without language supervision by predicting masked-region latent representations.,"Introduces RadJEPA, a self-supervised JEPA framework pretrained solely on unlabeled chest X-rays and evaluated on disease classification, semantic segmentation, and report generation.","RadJEPA outperforms state-of-the-art baselines, including Rad-DINO, across the reported radiology benchmarks.","The summary centers on chest X-rays, so extension to other medical imaging modalities is not established here.",Apply language-free JEPA pretraining to broader radiology and medical-imaging representation-learning tasks.,abstract-level synthesis
2601.14354,VJEPA: Variational Joint Embedding Predictive Architectures as Probabilistic World Models,arxiv,2026-01-20T18:04:16Z,Yongchao Huang,cs.LG,https://huggingface.co/papers/2601.14354,https://arxiv.org/abs/2601.14354,/root/workspace/jepa/pdfs/2601.14354.pdf,"Deterministic JEPA objectives obscure probabilistic semantics and limit use in stochastic control, so a variational probabilistic JEPA can provide uncertainty-aware world modeling without reconstructing observations.","Introduces Variational JEPA to learn a predictive distribution over future latent states with a variational objective, develops Bayesian JEPA with a product-of-experts belief factorization, proves links to PSRs/Bayesian filtering and control sufficiency, and tests the approach in a noisy environment experiment.","The paper claims VJEPA unifies JEPA-style representation learning with predictive state representations and Bayesian filtering, can avoid collapse, and in noisy experiments filters nuisance distractors better than generative baselines while enabling uncertainty estimates and modular constraint handling.",Evidence described in the abstract is centered on theory plus a noisy-environment experiment; broader empirical validation across more control domains is not reported there.,Apply probabilistic JEPA world models to broader uncertainty-aware planning problems and further explore zero-shot transfer or modular constraint satisfaction with the Bayesian extension.,abstract-level synthesis
2601.09524,Video Joint-Embedding Predictive Architectures for Facial Expression Recognition,arxiv,2026-01-14T14:48:11Z,Lennart Eing; Cristina Luna-Jiménez; Silvan Mertes; Elisabeth André,cs.CV; cs.HC,https://huggingface.co/papers/2601.09524,https://arxiv.org/abs/2601.09524,/root/workspace/jepa/pdfs/2601.09524.pdf,V-JEPA pretraining can support facial expression recognition by learning semantically useful video embeddings without relying on pixel-level reconstruction.,"Uses a pre-trained V-JEPA video encoder and trains shallow classifiers on the RAVDESS and CREMA-D datasets, with additional cross-dataset evaluation.","The abstract reports state-of-the-art performance on RAVDESS, the best vision-based result on CREMA-D (+1.48 WAR), and strong cross-dataset generalization.",The evidence presented is limited to the RAVDESS and CREMA-D FER benchmarks with shallow classifiers; wider task coverage is not discussed in the abstract.,Extend embedding-based JEPA pretraining to broader FER benchmarks and related affective video understanding tasks.,abstract-level synthesis
2601.01577,HanoiWorld : A Joint Embedding Predictive Architecture BasedWorld Model for Autonomous Vehicle Controller,arxiv,2026-01-04T15:49:46Z,Tran Tien Dat; Nguyen Hai An; Nguyen Khanh Viet Dung; Nguyen Duy Duc,cs.RO; cs.AI,https://huggingface.co/papers/2601.01577,https://arxiv.org/abs/2601.01577,/root/workspace/jepa/pdfs/2601.01577.pdf,A JEPA-based world model may offer a more safety-aware and effective alternative to data-hungry pixel-reconstruction reinforcement learning for autonomous vehicle control.,"Introduces Hanoi-World, a JEPA-based world model with an RNN for long-term horizontal planning, and evaluates it in multiple Highway-Env simulation settings.",The abstract says Hanoi-World can produce effective driving plans with safety awareness and achieves a favorable collision rate relative to stated baselines in the simulated environments.,"The reported evidence is confined to Highway-Env simulations, and the abstract does not provide broader validation, detailed metrics, or real-world testing.",Investigate JEPA-based planning for richer driving scenarios and study whether the safety-oriented world-model approach transfers beyond simulation.,abstract-level synthesis
2601.00366,BERT-JEPA: Reorganizing CLS Embeddings for Language-Invariant Semantics,arxiv,2026-01-01T14:59:58Z,Taj Gillin; Adam Lalani; Kenneth Zhang; Marcel Mateos Salles,cs.CL; cs.AI; cs.LG,https://huggingface.co/papers/2601.00366,https://arxiv.org/abs/2601.00366,/root/workspace/jepa/pdfs/2601.00366.pdf,Adding a JEPA objective to BERT-style models can reorganize the CLS embedding space into more language-invariant semantic structure and improve multilingual performance.,"Proposes BERT-JEPA, which augments BERT-style training with a JEPA objective targeting the CLS embedding space, and evaluates the result on multilingual benchmarks.","The abstract states that the approach combats collapsed CLS embeddings, yields a language-agnostic embedding space, and improves results across multilingual benchmarks.",The summary does not specify the multilingual benchmarks or discuss behavior beyond BERT-style models.,Explore JEPA-based objectives for multilingual representation learning in other language-model architectures and settings.,abstract-level synthesis
2601.00844,Value-guided action planning with JEPA world models,arxiv,2025-12-28T20:17:49Z,Matthieu Destrade; Oumayma Bounou; Quentin Le Lidec; Jean Ponce; Yann LeCun,cs.LG; cs.AI; cs.RO,https://huggingface.co/papers/2601.00844,https://arxiv.org/abs/2601.00844,/root/workspace/jepa/pdfs/2601.00844.pdf,JEPA world models can support better action planning when their embedding geometry is explicitly shaped to reflect goal-conditioned value.,"Introduces a training constraint so the negative goal-conditioned value function for reaching cost is approximated by distance between state embeddings, then compares the method with standard JEPA models on simple control tasks.",The abstract reports significantly improved planning performance over standard JEPA models on the evaluated simple control tasks.,"The empirical evidence mentioned is limited to simple control tasks, so broader planning settings are not established by the abstract alone.",Test value-shaped JEPA representations in more complex control domains and broader model-based planning problems.,abstract-level synthesis
2512.19171,JEPA-Reasoner: Decoupling Latent Reasoning from Token Generation,huggingface_papers;arxiv,2025-12-22T09:05:06Z,Bingyang Kelvin Liu; Ziyu Patrick Chen; David P. Woodruff,cs.CL,https://huggingface.co/papers/2512.19171,https://arxiv.org/abs/2512.19171,/root/workspace/jepa/pdfs/2512.19171.pdf,Reasoning should be decoupled from token generation so that latent reasoning is less vulnerable to expression errors and can better preserve uncertainty.,"Proposes JEPA-Reasoner, which uses a JEPA module for latent-space reasoning and a separate Talker module for linguistic reconstruction, and evaluates the design in controlled synthetic and natural-language experiments.","The abstract claims the decoupled design contains token-level errors, exposes the full latent reasoning trajectory to generation, supports mixed-hypothesis uncertainty, and yields a 149.5% 8-shot GSM8K improvement for a 0.9B model over a coupled Transformer baseline trained on the same data.",The evidence described is limited to controlled experiments and a specific model scale; wider benchmark coverage is not detailed in the abstract.,Pursue decoupled latent-reasoning architectures as an alternative scaling path for more robust complex reasoning systems.,abstract-level synthesis
2512.10942,VL-JEPA: Joint Embedding Predictive Architecture for Vision-language,huggingface_papers;arxiv,2025-12-11T18:59:22Z,Delong Chen; Mustafa Shukor; Theo Moutakanni; Willy Chung; Jade Yu; Tejaswi Kasarla; Yejin Bang; Allen Bolourchi; Yann LeCun; Pascale Fung,cs.CV,https://huggingface.co/papers/2512.10942,https://arxiv.org/abs/2512.10942,/root/workspace/jepa/pdfs/2512.10942.pdf,Predicting continuous text embeddings rather than autoregressively generating tokens can make vision-language models more parameter-efficient while preserving or improving performance.,"Builds a JEPA-based vision-language model that predicts target text embeddings, uses a lightweight decoder only when text output is needed, introduces selective decoding, and compares against standard token-space training under matched encoder and data conditions.","The abstract reports stronger performance than standard token-space training with 50% fewer trainable parameters, 2.85x fewer decoding operations with similar quality under selective decoding, superior average results to CLIP, SigLIP2, and Perception Encoder on video classification and retrieval, and VQA performance comparable to classical VLMs with 1.6B parameters.","The abstract highlights selected classification, retrieval, and VQA evaluations, but does not detail broader generative-language behavior or other deployment tradeoffs.",Extend JEPA-style vision-language learning to richer multimodal tasks and further exploit adaptive decoding for efficient inference.,abstract-level synthesis
2512.07168,JEPA as a Neural Tokenizer: Learning Robust Speech Representations with Density Adaptive Attention,huggingface_papers;arxiv,2025-12-08T05:01:51Z,Georgios Ioannides; Christos Constantinou; Aman Chadha; Aaron Elkins; Linsey Pang; Ravid Shwartz-Ziv; Yann LeCun,cs.SD; cs.AI; cs.LG; eess.AS,https://huggingface.co/papers/2512.07168,https://arxiv.org/abs/2512.07168,/root/workspace/jepa/pdfs/2512.07168.pdf,A JEPA-based latent prediction stage combined with density-adaptive attention can learn robust speech representations that also support efficient neural tokenization.,"Uses a two-stage framework: first JEPA with density adaptive attention learns semantic audio features via masked latent prediction, then finite scalar quantization, mixed-radix packing, and a HiFi-GAN decoder produce reversible tokens and waveform reconstruction.",The abstract says the method discovers hierarchical speech structure with adaptive temporal feature selection at 2.5 Hz and yields reversible compressed tokens at 47.5 tokens/sec that are competitive with and often more efficient than existing neural audio codecs.,"The abstract does not name benchmark datasets or downstream speech tasks, so empirical scope is only broadly described there.",Develop language-model-friendly speech tokenizers and compressed audio representations building on JEPA-style latent speech learning.,abstract-level synthesis
2511.18424,CrossJEPA: Cross-Modal Joint-Embedding Predictive Architecture for Efficient 3D Representation Learning from 2D Images,arxiv,2025-11-23T12:40:04Z,Avishka Perera; Kumal Hewagamage; Saeedha Nazar; Kavishka Abeywardana; Hasitha Gallella; Ranga Rodrigo; Mohamed Afham,cs.CV,https://huggingface.co/papers/2511.18424,https://arxiv.org/abs/2511.18424,/root/workspace/jepa/pdfs/2511.18424.pdf,Cross-modal JEPA pretraining can turn 2D image supervision into an efficient route for strong 3D representation learning from point clouds.,"Introduces CrossJEPA, which distills embeddings from a frozen image foundation model into a point-cloud encoder by predicting rendered 2D view embeddings, with cross-domain projection conditioning and cached target embeddings for efficiency.","The abstract reports new state-of-the-art linear-probing accuracy on ModelNet40 (94.2%) and ScanObjectNN (88.3%) using 14.1M pretraining parameters and about six hours on a single GPU, while emphasizing memory and compute efficiency.",The evidence emphasized in the abstract centers on linear probing over two 3D benchmarks; broader 3D tasks are not discussed there.,Apply cross-modal JEPA distillation to additional 3D tasks and further exploit efficient frozen-teacher pretraining in resource-constrained settings.,abstract-level synthesis
2511.17354,DSeq-JEPA: Discriminative Sequential Joint-Embedding Predictive Architecture,huggingface_papers;arxiv,2025-11-21T16:18:50Z,Xiangteng He; Shunsuke Sakai; Shivam Chandhok; Sara Beery; Kun Yuan; Nicolas Padoy; Tatsuhito Hasegawa; Leonid Sigal,cs.CV,https://huggingface.co/papers/2511.17354,https://arxiv.org/abs/2511.17354,/root/workspace/jepa/pdfs/2511.17354.pdf,Sequentially predicting image regions in discriminative order can overcome the limitations of parallel I-JEPA prediction and yield stronger visual representations.,"Proposes DSeq-JEPA, which uses attention-derived saliency to identify primary discriminative regions and then predicts later regions sequentially in a curriculum-like order, with evaluations across classification, fine-grained recognition, detection, segmentation, and reasoning tasks.",The abstract states that DSeq-JEPA consistently learns more discriminative and generalizable representations than I-JEPA variants across the evaluated tasks.,The summary focuses on comparisons with I-JEPA variants on visual tasks and does not discuss possible computational tradeoffs in the abstract.,Explore sequential discriminative prediction in broader self-supervised visual learning and reasoning settings.,abstract-level synthesis
2511.09783,Koopman Invariants as Drivers of Emergent Time-Series Clustering in Joint-Embedding Predictive Architectures,arxiv,2025-11-12T22:33:56Z,Pablo Ruiz-Morales; Dries Vanoost; Davy Pissoort; Mathias Verbeke,cs.LG; cs.AI,https://huggingface.co/papers/2511.09783,https://arxiv.org/abs/2511.09783,/root/workspace/jepa/pdfs/2511.09783.pdf,"JEPA time-series clustering can be explained by the predictive objective implicitly learning Koopman invariants, rather than by an unexplained emergent effect.","Develops a theoretical analysis showing when an idealized JEPA loss is minimized by regime-indicator representations tied to Koopman eigenfunctions, and validates the explanation on synthetic data with known dynamics.","The abstract claims the theory explains regime clustering, identifies a near-identity linear predictor as the key inductive bias for learning invariants, and links predictor design to representation disentanglement.","Validation is described on synthetic data and an idealized theoretical setting, with no real-world time-series evaluation mentioned in the abstract.",Use the Koopman-based perspective to design more interpretable and robust JEPA models for time-series analysis.,abstract-level synthesis
