paper_id,title,source,published,authors,categories,hf_papers_url,arxiv_url,local_pdf,principal_argument,methodology,main_findings,limitations_or_gaps,future_opportunities,notes
2601.01577,HanoiWorld : A Joint Embedding Predictive Architecture BasedWorld Model for Autonomous Vehicle Controller,arxiv,2026-01-04T15:49:46Z,Tran Tien Dat; Nguyen Hai An; Nguyen Khanh Viet Dung; Nguyen Duy Duc,cs.RO; cs.AI,https://huggingface.co/papers/2601.01577,https://arxiv.org/abs/2601.01577,/root/workspace/jepa/pdfs/2601.01577.pdf,A JEPA-based world model may offer a more safety-aware and effective alternative to data-hungry pixel-reconstruction reinforcement learning for autonomous vehicle control.,"Introduces Hanoi-World, a JEPA-based world model with an RNN for long-term horizontal planning, and evaluates it in multiple Highway-Env simulation settings.",The abstract says Hanoi-World can produce effective driving plans with safety awareness and achieves a favorable collision rate relative to stated baselines in the simulated environments.,"The reported evidence is confined to Highway-Env simulations, and the abstract does not provide broader validation, detailed metrics, or real-world testing.",Investigate JEPA-based planning for richer driving scenarios and study whether the safety-oriented world-model approach transfers beyond simulation.,abstract-level synthesis
2601.00366,BERT-JEPA: Reorganizing CLS Embeddings for Language-Invariant Semantics,arxiv,2026-01-01T14:59:58Z,Taj Gillin; Adam Lalani; Kenneth Zhang; Marcel Mateos Salles,cs.CL; cs.AI; cs.LG,https://huggingface.co/papers/2601.00366,https://arxiv.org/abs/2601.00366,/root/workspace/jepa/pdfs/2601.00366.pdf,Adding a JEPA objective to BERT-style models can reorganize the CLS embedding space into more language-invariant semantic structure and improve multilingual performance.,"Proposes BERT-JEPA, which augments BERT-style training with a JEPA objective targeting the CLS embedding space, and evaluates the result on multilingual benchmarks.","The abstract states that the approach combats collapsed CLS embeddings, yields a language-agnostic embedding space, and improves results across multilingual benchmarks.",The summary does not specify the multilingual benchmarks or discuss behavior beyond BERT-style models.,Explore JEPA-based objectives for multilingual representation learning in other language-model architectures and settings.,abstract-level synthesis
2512.24497,What Drives Success in Physical Planning with Joint-Embedding Predictive World Models?,huggingface_papers;arxiv,2025-12-30T22:50:03Z,Basile Terver; Tsung-Yen Yang; Jean Ponce; Adrien Bardes; Yann LeCun,cs.AI; cs.LG; cs.RO; stat.ML,https://huggingface.co/papers/2512.24497,https://arxiv.org/abs/2512.24497,/root/workspace/jepa/pdfs/2512.24497.pdf,"Success in representation-space physical planning with JEPA world models depends on specific technical choices in architecture, training objective, and planning algorithm.","The paper defines this family as JEPA-WMs, performs a comparative study of key design components on simulated environments and real robotic data, and combines the strongest choices into a new model.",The resulting model outperforms DINO-WM and V-JEPA-2-AC on both navigation and manipulation tasks.,The abstract does not detail the full quantitative effect of each design choice or whether the conclusions transfer beyond the studied tasks and datasets.,"Extend JEPA-WM analysis to broader robotic settings, probe interactions among planning and representation choices, and test generalization to more unseen tasks and environments.",abstract-level synthesis
2601.00844,Value-guided action planning with JEPA world models,arxiv,2025-12-28T20:17:49Z,Matthieu Destrade; Oumayma Bounou; Quentin Le Lidec; Jean Ponce; Yann LeCun,cs.LG; cs.AI; cs.RO,https://huggingface.co/papers/2601.00844,https://arxiv.org/abs/2601.00844,/root/workspace/jepa/pdfs/2601.00844.pdf,JEPA world models can support better action planning when their embedding geometry is explicitly shaped to reflect goal-conditioned value.,"Introduces a training constraint so the negative goal-conditioned value function for reaching cost is approximated by distance between state embeddings, then compares the method with standard JEPA models on simple control tasks.",The abstract reports significantly improved planning performance over standard JEPA models on the evaluated simple control tasks.,"The empirical evidence mentioned is limited to simple control tasks, so broader planning settings are not established by the abstract alone.",Test value-shaped JEPA representations in more complex control domains and broader model-based planning problems.,abstract-level synthesis
2512.21881,SLIM-Brain: A Data- and Training-Efficient Foundation Model for fMRI Data Analysis,huggingface_papers;arxiv,2025-12-26T06:10:31Z,Mo Wang; Junfeng Xia; Wenhao Ye; Enyu Liu; Kaining Peng; Jianfeng Feng; Quanying Liu; Hongkai Wen,cs.CV; q-bio.NC,https://huggingface.co/papers/2512.21881,https://arxiv.org/abs/2512.21881,/root/workspace/jepa/pdfs/2512.21881.pdf,An atlas-free JEPA-style design can improve both data efficiency and training efficiency for voxel-level fMRI foundation modeling without sacrificing fine-grained spatial detail.,SLIM-Brain uses a two-stage pipeline in which a lightweight temporal extractor ranks windows by saliency and a 4D Hiera-JEPA encoder learns voxel-level representations from the top-k windows while deleting about 70% of masked patches.,"Across seven public benchmarks, the model achieves new state-of-the-art results while needing only 4 thousand pre-training sessions and roughly 30% of the GPU memory of traditional voxel-level methods.","The abstract emphasizes benchmark performance and efficiency, but does not spell out cross-site robustness, clinical deployment constraints, or weaker task settings.","Scale the approach to more neuroimaging cohorts and tasks, refine saliency selection, and test robustness across acquisition settings and populations.",abstract-level synthesis
2512.19605,KerJEPA: Kernel Discrepancies for Euclidean Self-Supervised Learning,arxiv,2025-12-22T17:41:26Z,Eric Zimmermann; Harley Wiltzer; Justin Szeto; David Alvarez-Melis; Lester Mackey,cs.LG; cs.CV,https://huggingface.co/papers/2512.19605,https://arxiv.org/abs/2512.19605,/root/workspace/jepa/pdfs/2512.19605.pdf,Kernel-based regularizers broaden JEPA-style Euclidean self-supervised learning and can improve stability while offering more design flexibility than a single Gaussian-prior regularizer.,"The paper defines a family of KerJEPAs, connects one case to the LeJEPA Epps-Pulley regularizer, expands the set of admissible kernels and priors, and derives the closed-form high-dimensional limit of sliced MMDs.",The resulting KerJEPA variants are described as having improved training stability and greater flexibility in regularizer design.,The abstract does not include benchmark-by-benchmark downstream results or specify which kernels and priors are best in different practical settings.,"Evaluate kernel and prior choices across more tasks, adapt the framework to additional JEPA variants, and study how the theoretical results translate into downstream gains.",abstract-level synthesis
2512.19171,JEPA-Reasoner: Decoupling Latent Reasoning from Token Generation,huggingface_papers;arxiv,2025-12-22T09:05:06Z,Bingyang Kelvin Liu; Ziyu Patrick Chen; David P. Woodruff,cs.CL,https://huggingface.co/papers/2512.19171,https://arxiv.org/abs/2512.19171,/root/workspace/jepa/pdfs/2512.19171.pdf,Reasoning should be decoupled from token generation so that latent reasoning is less vulnerable to expression errors and can better preserve uncertainty.,"Proposes JEPA-Reasoner, which uses a JEPA module for latent-space reasoning and a separate Talker module for linguistic reconstruction, and evaluates the design in controlled synthetic and natural-language experiments.","The abstract claims the decoupled design contains token-level errors, exposes the full latent reasoning trajectory to generation, supports mixed-hypothesis uncertainty, and yields a 149.5% 8-shot GSM8K improvement for a 0.9B model over a coupled Transformer baseline trained on the same data.",The evidence described is limited to controlled experiments and a specific model scale; wider benchmark coverage is not detailed in the abstract.,Pursue decoupled latent-reasoning architectures as an alternative scaling path for more robust complex reasoning systems.,abstract-level synthesis
2512.15885,Seeing Beyond Words: Self-Supervised Visual Learning for Multimodal Large Language Models,huggingface_papers;arxiv,2025-12-17T19:01:34Z,Davide Caffagni; Sara Sarto; Marcella Cornia; Lorenzo Baraldi; Pier Luigi Dovesi; Shaghayegh Roohi; Mark Granroth-Wilding; Rita Cucchiara,cs.CV; cs.AI; cs.CL; cs.MM,https://huggingface.co/papers/2512.15885,https://arxiv.org/abs/2512.15885,/root/workspace/jepa/pdfs/2512.15885.pdf,MLLMs can gain stronger visual understanding by adding JEPA-inspired self-supervised visual learning instead of relying primarily on text supervision.,"The proposed JARVIS framework integrates the I-JEPA learning paradigm into vision-language alignment, uses frozen vision foundation models as context and target encoders, and trains the predictor via early LLM layers.","Across different LLM families, JARVIS consistently improves vision-centric benchmark performance without hurting multimodal reasoning ability.","The abstract does not describe compute trade-offs, where the gains are smallest, or how much the method depends on the chosen frozen vision encoders.","Apply JEPA-style visual enhancement to broader MLLM settings, study scaling and efficiency, and probe how it changes visual reasoning behavior.",abstract-level synthesis
2512.13684,Recurrent Video Masked Autoencoders,huggingface_papers;arxiv,2025-12-15T18:59:48Z,Daniel Zoran; Nikhil Parthasarathy; Yi Yang; Drew A Hudson; Joao Carreira; Andrew Zisserman,cs.CV,https://huggingface.co/papers/2512.13684,https://arxiv.org/abs/2512.13684,/root/workspace/jepa/pdfs/2512.13684.pdf,Recurrent computation can make video masked autoencoders more efficient while preserving strong general-purpose video representations.,RVM combines an asymmetric masking objective with a transformer-based recurrent neural network and trains only with a pixel reconstruction loss to aggregate temporal information efficiently.,"The model is competitive with VideoMAE and V-JEPA on video-level tasks, matches or exceeds strong image models on geometry-heavy tasks, achieves up to 30x better parameter efficiency in the small-model regime, and supports stable long-horizon feature propagation with linear cost.",The abstract does not present full trade-offs against all baselines or identify settings where recurrent masking is weaker than attention-heavy alternatives.,"Scale recurrent video representation learning further, test more long-horizon tasks, and explore how recurrence interacts with other self-supervised objectives.",abstract-level synthesis
2512.10942,VL-JEPA: Joint Embedding Predictive Architecture for Vision-language,huggingface_papers;arxiv,2025-12-11T18:59:22Z,Delong Chen; Mustafa Shukor; Theo Moutakanni; Willy Chung; Jade Yu; Tejaswi Kasarla; Yejin Bang; Allen Bolourchi; Yann LeCun; Pascale Fung,cs.CV,https://huggingface.co/papers/2512.10942,https://arxiv.org/abs/2512.10942,/root/workspace/jepa/pdfs/2512.10942.pdf,Predicting continuous text embeddings rather than autoregressively generating tokens can make vision-language models more parameter-efficient while preserving or improving performance.,"Builds a JEPA-based vision-language model that predicts target text embeddings, uses a lightweight decoder only when text output is needed, introduces selective decoding, and compares against standard token-space training under matched encoder and data conditions.","The abstract reports stronger performance than standard token-space training with 50% fewer trainable parameters, 2.85x fewer decoding operations with similar quality under selective decoding, superior average results to CLIP, SigLIP2, and Perception Encoder on video classification and retrieval, and VQA performance comparable to classical VLMs with 1.6B parameters.","The abstract highlights selected classification, retrieval, and VQA evaluations, but does not detail broader generative-language behavior or other deployment tradeoffs.",Extend JEPA-style vision-language learning to richer multimodal tasks and further exploit adaptive decoding for efficient inference.,abstract-level synthesis
2512.07168,JEPA as a Neural Tokenizer: Learning Robust Speech Representations with Density Adaptive Attention,huggingface_papers;arxiv,2025-12-08T05:01:51Z,Georgios Ioannides; Christos Constantinou; Aman Chadha; Aaron Elkins; Linsey Pang; Ravid Shwartz-Ziv; Yann LeCun,cs.SD; cs.AI; cs.LG; eess.AS,https://huggingface.co/papers/2512.07168,https://arxiv.org/abs/2512.07168,/root/workspace/jepa/pdfs/2512.07168.pdf,A JEPA-based latent prediction stage combined with density-adaptive attention can learn robust speech representations that also support efficient neural tokenization.,"Uses a two-stage framework: first JEPA with density adaptive attention learns semantic audio features via masked latent prediction, then finite scalar quantization, mixed-radix packing, and a HiFi-GAN decoder produce reversible tokens and waveform reconstruction.",The abstract says the method discovers hierarchical speech structure with adaptive temporal feature selection at 2.5 Hz and yields reversible compressed tokens at 47.5 tokens/sec that are competitive with and often more efficient than existing neural audio codecs.,"The abstract does not name benchmark datasets or downstream speech tasks, so empirical scope is only broadly described there.",Develop language-model-friendly speech tokenizers and compressed audio representations building on JEPA-style latent speech learning.,abstract-level synthesis
2512.06628,MIND-V: Hierarchical World Model for Long-Horizon Robotic Manipulation with RL-based Physical Alignment,huggingface_papers;arxiv,2025-12-07T02:28:06Z,Ruicheng Zhang; Mingyang Zhang; Jun Zhou; Zhangrui Guo; Zunnan Xu; Xiaofan Liu; Zhizhou Zhong; Puxin Yan; Haocheng Luo; Xiu Li,cs.RO; cs.CV,https://huggingface.co/papers/2512.06628,https://arxiv.org/abs/2512.06628,/root/workspace/jepa/pdfs/2512.06628.pdf,A hierarchical world model with explicit semantic reasoning and RL-based physical alignment can synthesize more plausible long-horizon robotic manipulation videos and support policy learning.,"MIND-V combines a Semantic Reasoning Hub, a Behavioral Semantic Bridge, a Motor Video Generator, staged visual future rollouts, and GRPO post-training with a Physical Foresight Coherence reward that uses V-JEPA2 as a physics referee.",The abstract reports state-of-the-art performance in long-horizon simulation and meaningful value for downstream policy learning while emphasizing physically plausible and logically coherent video synthesis.,"The evidence described in the abstract is mainly simulation-based, with no detailed real-world robotic deployment or component-level quantitative breakdown.","Test the framework on physical robots, expand autonomous embodied data synthesis, and study how world-model planning and physical alignment interact at larger scales.",abstract-level synthesis
2512.06232,Opinion: Learning Intuitive Physics May Require More than Visual Data,arxiv,2025-12-06T00:49:41Z,Ellen Su; Solim Legris; Todd M. Gureckis; Mengye Ren,cs.CV; cs.LG,https://huggingface.co/papers/2512.06232,https://arxiv.org/abs/2512.06232,/root/workspace/jepa/pdfs/2512.06232.pdf,Improving intuitive-physics learning may require more than changing visual data volume or distribution for current V-JEPA-style models.,"The authors pretrain a V-JEPA model on the developmentally realistic, egocentric SAYCam dataset and evaluate the resulting representations on the IntPhys2 benchmark.","Training on SAYCam, despite its developmental realism, does not produce significant gains on IntPhys2, suggesting that data distribution and volume alone are insufficient for current architectures.","The abstract is limited to one dataset framing and benchmark setting, and leaves open whether different architectures, objectives, or nonvisual signals would change the outcome.","Investigate multimodal learning, architectural changes, and alternative training objectives for intuitive physics beyond visual-only pretraining.",abstract-level synthesis
2511.23428,DisMo: Disentangled Motion Representations for Open-World Motion Transfer,arxiv,2025-11-28T18:25:54Z,Thomas Ressler-Antal; Frank Fundel; Malek Ben Alaya; Stefan Andreas Baumann; Felix Krause; Ming Gui; Björn Ommer,cs.CV,https://huggingface.co/papers/2511.23428,https://arxiv.org/abs/2511.23428,/root/workspace/jepa/pdfs/2511.23428.pdf,A motion representation disentangled from static content can enable open-world motion transfer and stronger motion understanding than content-entangled video models.,DisMo learns abstract motion representations directly from raw video through an image-space reconstruction objective and connects them to existing video generators via lightweight adapters.,"The method supports motion transfer across semantically unrelated entities, improves control without the usual fidelity-versus-prompt trade-off described in prior work, and outperforms V-JEPA on cited zero-shot action-classification benchmarks.","The abstract does not quantify computational costs, failure cases, or how performance varies across different generator backbones and transfer scenarios.","Integrate the representation into more video generators, expand motion-editing applications, and probe its value on broader downstream motion benchmarks.",abstract-level synthesis
2511.18640,Health system learning achieves generalist neuroimaging models,huggingface_papers;arxiv,2025-11-23T22:34:50Z,Akhil Kondepudi; Akshay Rao; Chenhui Zhao; Yiwei Lyu; Samir Harake; Soumyanil Banerjee; Rushikesh Joshi; Anna-Katharina Meissner; Renly Hou; Cheng Jiang; Asadur Chowdury; Ashok Srinivasan; Brian Athey; Vikas Gulani; Aditya Pandey; Honglak Lee; Todd Hollon,cs.CV; cs.AI; cs.LG,https://huggingface.co/papers/2511.18640,https://arxiv.org/abs/2511.18640,/root/workspace/jepa/pdfs/2511.18640.pdf,Training directly on large-scale private clinical neuroimaging data can produce generalist medical vision models that outperform frontier public-data models on neuroimaging tasks.,The work trains NeuroVFM on 5.24 million clinical MRI and CT volumes using a scalable volumetric joint-embedding predictive architecture and then pairs it with open-source language models through lightweight visual instruction tuning for report generation.,"NeuroVFM achieves state-of-the-art performance across multiple clinical tasks, shows emergent neuroanatomic understanding and interpretable grounding, improves radiology report generation, and reduces hallucinated findings and critical errors relative to frontier models.","The abstract does not discuss external validation across institutions, data-governance constraints, or operational deployment details beyond the reported task results.","Extend health system learning across more institutions and imaging modalities, deepen safety and governance studies, and adapt the framework to additional clinical workflows.",abstract-level synthesis
2511.18424,CrossJEPA: Cross-Modal Joint-Embedding Predictive Architecture for Efficient 3D Representation Learning from 2D Images,arxiv,2025-11-23T12:40:04Z,Avishka Perera; Kumal Hewagamage; Saeedha Nazar; Kavishka Abeywardana; Hasitha Gallella; Ranga Rodrigo; Mohamed Afham,cs.CV,https://huggingface.co/papers/2511.18424,https://arxiv.org/abs/2511.18424,/root/workspace/jepa/pdfs/2511.18424.pdf,Cross-modal JEPA pretraining can turn 2D image supervision into an efficient route for strong 3D representation learning from point clouds.,"Introduces CrossJEPA, which distills embeddings from a frozen image foundation model into a point-cloud encoder by predicting rendered 2D view embeddings, with cross-domain projection conditioning and cached target embeddings for efficiency.","The abstract reports new state-of-the-art linear-probing accuracy on ModelNet40 (94.2%) and ScanObjectNN (88.3%) using 14.1M pretraining parameters and about six hours on a single GPU, while emphasizing memory and compute efficiency.",The evidence emphasized in the abstract centers on linear probing over two 3D benchmarks; broader 3D tasks are not discussed there.,Apply cross-modal JEPA distillation to additional 3D tasks and further exploit efficient frozen-teacher pretraining in resource-constrained settings.,abstract-level synthesis
2511.17354,DSeq-JEPA: Discriminative Sequential Joint-Embedding Predictive Architecture,huggingface_papers;arxiv,2025-11-21T16:18:50Z,Xiangteng He; Shunsuke Sakai; Shivam Chandhok; Sara Beery; Kun Yuan; Nicolas Padoy; Tatsuhito Hasegawa; Leonid Sigal,cs.CV,https://huggingface.co/papers/2511.17354,https://arxiv.org/abs/2511.17354,/root/workspace/jepa/pdfs/2511.17354.pdf,Sequentially predicting image regions in discriminative order can overcome the limitations of parallel I-JEPA prediction and yield stronger visual representations.,"Proposes DSeq-JEPA, which uses attention-derived saliency to identify primary discriminative regions and then predicts later regions sequentially in a curriculum-like order, with evaluations across classification, fine-grained recognition, detection, segmentation, and reasoning tasks.",The abstract states that DSeq-JEPA consistently learns more discriminative and generalizable representations than I-JEPA variants across the evaluated tasks.,The summary focuses on comparisons with I-JEPA variants on visual tasks and does not discuss possible computational tradeoffs in the abstract.,Explore sequential discriminative prediction in broader self-supervised visual learning and reasoning settings.,abstract-level synthesis
2511.16567,POMA-3D: The Point Map Way to 3D Scene Understanding,arxiv,2025-11-20T17:22:51Z,Ye Mao; Weixun Luo; Ranran Huang; Junpeng Jing; Krystian Mikolajczyk,cs.CV,https://huggingface.co/papers/2511.16567,https://arxiv.org/abs/2511.16567,/root/workspace/jepa/pdfs/2511.16567.pdf,"Point maps, combined with JEPA-style multi-view consistency, can provide a strong self-supervised foundation for 3D scene understanding using geometric inputs alone.","POMA-3D learns from point maps laid out on structured 2D grids, transfers 2D priors through view-to-scene alignment, enforces cross-view consistency with POMA-JEPA, and pretrains on the new ScenePoint dataset built from room-level RGB-D scenes and 2D image scenes.","The model serves as a strong specialist and generalist 3D backbone across tasks including 3D question answering, embodied navigation, scene retrieval, and embodied localization, all using only 3D coordinates.","The abstract does not detail trade-offs against RGB-based approaches, compute demands, or which task settings benefit most from point-map pretraining.","Scale point-map pretraining further, test more embodied and 3D reasoning tasks, and explore richer multimodal extensions built on the POMA-JEPA framework.",abstract-level synthesis
2511.16333,"Beyond Generative AI: World Models for Clinical Prediction, Counterfactuals, and Planning",arxiv,2025-11-20T13:11:45Z,Mohammad Areeb Qazi; Maryam Nadeem; Mohammad Yaqub,cs.LG,https://huggingface.co/papers/2511.16333,https://arxiv.org/abs/2511.16333,/root/workspace/jepa/pdfs/2511.16333.pdf,"Clinical AI needs predictive, temporally coherent, and causally grounded world models rather than relying only on large generative models for decision support.","Review paper surveying healthcare world-model work across medical imaging, EHR-based disease progression, and robotic surgery, while introducing a four-level capability rubric from temporal prediction to planning/control.","Most reviewed systems reach temporal or action-conditioned prediction (L1-L2), while counterfactual decision support (L3) is less common and planning/control (L4) is rare.","The review highlights under-specified action spaces and safety constraints, weak interventional validation, incomplete multimodal state construction, and limited trajectory-level uncertainty calibration.",The paper calls for prediction-first clinical world models that combine generative backbones with causal or mechanical foundations for safer decision support.,abstract-level synthesis
2511.10894,DINOv3 as a Frozen Encoder for CRPS-Oriented Probabilistic Rainfall Nowcasting,arxiv,2025-11-14T02:14:08Z,Luciano Araujo Dourado Filho; Almir Moreira da Silva Neto; Anthony Miyaguchi; Rodrigo Pereira David; Rodrigo Tripodi Calumby; Lukáš Picek,cs.CV; cs.AI,https://huggingface.co/papers/2511.10894,https://arxiv.org/abs/2511.10894,/root/workspace/jepa/pdfs/2511.10894.pdf,A frozen satellite vision encoder paired with a V-JEPA-style projector and lightweight probabilistic head can deliver efficient and competitive probabilistic rainfall nowcasting.,"Attach a video projector and probabilistic head to a pretrained DINOv3-SAT493M encoder, map tokens to a discrete empirical CDF over 4-hour rainfall, optimize with Ranked Probability Score, and compare against 3D-UNET baselines.","On Weather4Cast 2025, the method reached a CRPS of 3.5102, reported as about a 26% effectiveness gain over the best 3D-UNET baseline.",Not specified in summary.,"The summary positions the approach as a promising, computationally efficient path for probabilistic rainfall nowcasting.",abstract-level synthesis
