paper_id,title,source,published,authors,categories,hf_papers_url,arxiv_url,local_pdf,principal_argument,methodology,main_findings,limitations_or_gaps,future_opportunities,notes
2602.02620,CryoLVM: Self-supervised Learning from Cryo-EM Density Maps with Large Vision Models,arxiv,2026-02-02T13:36:36Z,Weining Fu; Kai Shu; Kui Xu; Qiangfeng Cliff Zhang,q-bio.QM; cs.AI; cs.LG,https://huggingface.co/papers/2602.02620,https://arxiv.org/abs/2602.02620,/root/workspace/jepa/pdfs/2602.02620.pdf,A JEPA-based cryo-EM foundation model can learn transferable structural representations that support multiple downstream restoration and enhancement tasks.,"Introduces CryoLVM by combining JEPA with a SCUNet-based backbone and a histogram-based distribution-alignment loss, then adapts the model to sharpening, super-resolution, and missing-wedge restoration.",CryoLVM consistently outperforms strong baselines across multiple density-map quality metrics on all three evaluated cryo-EM tasks.,"The summary focuses on density maps with resolved structures and on three downstream tasks, without claiming broader coverage of other cryo-EM settings.",Use unified self-supervised structural pretraining for a wider range of cryo-EM analysis tasks.,abstract-level synthesis
2602.07016,Gaussian-Constrained LeJEPA Representations for Unsupervised Scene Discovery and Pose Consistency,arxiv,2026-01-31T19:52:54Z,Mohsen Mostafa,cs.CV,https://huggingface.co/papers/2602.07016,https://arxiv.org/abs/2602.07016,/root/workspace/jepa/pdfs/2602.07016.pdf,Gaussian-constrained embeddings inspired by LeJEPA can improve unsupervised scene discovery and pose consistency in ambiguous multi-scene image collections.,"Evaluates three increasingly refined pipelines on the IMC2025 challenge, culminating in a LeJEPA-inspired approach that enforces isotropic Gaussian constraints on image embeddings for clustering and pose estimation.","Gaussian-constrained embeddings improve scene separation and pose plausibility over heuristic baselines, especially in visually ambiguous settings.","The work is explicitly empirical rather than theoretical, and the summary grounds the evidence in the IMC2025 setting.",Further connect self-supervised representation constraints with practical structure-from-motion pipelines and test them under broader real-world ambiguity.,abstract-level synthesis
2602.09040,Soft Clustering Anchors for Self-Supervised Speech Representation Learning in Joint Embedding Prediction Architectures,huggingface_papers;arxiv,2026-01-30T20:51:37Z,Georgios Ioannides; Adrian Kieback; Judah Goldfeder; Linsey Pang; Aman Chadha; Aaron Elkins; Yann LeCun; Ravid Shwartz-Ziv,eess.AS; cs.AI; cs.LG; cs.SD,https://huggingface.co/papers/2602.09040,https://arxiv.org/abs/2602.09040,/root/workspace/jepa/pdfs/2602.09040.pdf,"Speech JEPAs benefit from explicit grounding, and one-shot soft clustering anchors from a frozen GMM can stabilize training without iterative reclustering.",Fits a Gaussian Mixture Model once on log-mel spectrograms and uses its frozen soft posteriors as auxiliary targets with a decaying supervision schedule during JEPA training on roughly 50k hours of speech.,"GMM anchoring improves ASR, emotion recognition, and slot filling relative to a matched-compute WavLM-style baseline, while producing far more uniform cluster utilization.",The summary compares primarily against a WavLM-style baseline and does not detail broader compute tradeoffs or comparisons to more methods.,Scale soft-anchored speech representation learning further and investigate other non-iterative grounding signals for JEPA training.,abstract-level synthesis
2601.22128,The Patient is not a Moving Document: A World Model Training Paradigm for Longitudinal EHR,huggingface_papers;arxiv,2026-01-29T18:49:37Z,Irsyad Adam; Zekai Chen; David Laprade; Shaun Porwal; David Laub; Erik Reinertsen; Arda Pekis; Kevin Brown,cs.AI; cs.CE; q-bio.QM,https://huggingface.co/papers/2601.22128,https://arxiv.org/abs/2601.22128,/root/workspace/jepa/pdfs/2601.22128.pdf,"Clinical foundation models should model patients as evolving dynamical systems rather than static documents, and combining JEPA with next-token prediction better captures disease trajectories.","Introduces SMB-Structure, a structured-EHR world model that pairs next-token prediction with latent JEPA prediction, and evaluates learned embeddings with linear probes across disease trajectories in two large cohorts.","The training paradigm learns embeddings that capture disease dynamics not recovered by autoregressive baselines and achieves competitive performance on complex, heterogeneous clinical tasks.","The summary is centered on structured EHR data and two cohorts, and it does not specify broader deployment evidence beyond those settings.","Develop richer patient world models for additional cohorts, interventions, and longitudinal clinical prediction tasks.",abstract-level synthesis
2601.20190,WirelessJEPA: A Multi-Antenna Foundation Model using Spatio-temporal Wireless Latent Predictions,arxiv,2026-01-28T02:39:47Z,Viet Chu; Omar Mashaal; Hatem Abou-Zeid,eess.SP,https://huggingface.co/papers/2601.20190,https://arxiv.org/abs/2601.20190,/root/workspace/jepa/pdfs/2601.20190.pdf,JEPA can serve as a generalizable wireless foundation model when adapted to real-world multi-antenna IQ data with structured spatiotemporal latent prediction.,"The paper reshapes multi-antenna IQ streams into a 2D antenna-time representation, applies block masking and sparse convolutional processing, and trains WirelessJEPA to predict latent representations of masked signal regions with spatiotemporal mask geometries before evaluating six downstream tasks.",WirelessJEPA learns general-purpose wireless representations without handcrafted contrastive augmentations and shows robust performance and strong task generalization across six downstream tasks.,"The abstract does not provide per-task quantitative detail, failure cases, or evaluation beyond the six reported downstream tasks.","Scale JEPA-style pretraining to broader wireless settings, test additional downstream tasks and modalities, and refine antenna-time masking strategies.",abstract-level synthesis
2601.17216,Spatiotemporal Semantic V2X Framework for Cooperative Collision Prediction,arxiv,2026-01-23T23:02:04Z,Murat Arda Onsu; Poonam Lohan; Burak Kantarci; Aisha Syed; Matthew Andrews; Sean Kennedy,cs.CV; cs.AI; cs.LG; eess.IV,https://huggingface.co/papers/2601.17216,https://arxiv.org/abs/2601.17216,/root/workspace/jepa/pdfs/2601.17216.pdf,Semantic V2X communication based on V-JEPA embeddings can support cooperative collision prediction while dramatically lowering communication load relative to raw video transmission.,"RSU-mounted cameras generate spatiotemporal semantic embeddings of future frames with V-JEPA in a digital twin traffic environment, and vehicles use a lightweight attentive probe and classifier to decode those embeddings for imminent collision prediction.","The framework improves collision-prediction F1 by 10% and cuts transmission requirements by four orders of magnitude versus sending raw video, while preserving predictive utility.","The abstract centers on a digital twin evaluation and does not describe real-world deployment performance, robustness, or detailed latency trade-offs.","Validate semantic V2X collision prediction in live ITS settings, optimize embedding processing and communication pipelines, and extend the approach to other cooperative safety tasks.",abstract-level synthesis
2601.10592,Action100M: A Large-scale Video Action Dataset,huggingface_papers;arxiv,2026-01-15T17:02:27Z,Delong Chen; Tejaswi Kasarla; Yejin Bang; Mustafa Shukor; Willy Chung; Jade Yu; Allen Bolourchi; Theo Moutakanni; Pascale Fung,cs.CV,https://huggingface.co/papers/2601.10592,https://arxiv.org/abs/2601.10592,/root/workspace/jepa/pdfs/2601.10592.pdf,"A very large, automatically constructed open-vocabulary video action dataset can provide a stronger foundation for scalable video understanding and world modeling.","Action100M is built from 1.2M instructional videos using V-JEPA 2 embeddings for hierarchical temporal segmentation, a Tree-of-Captions pipeline, and GPT-OSS-120B with multi-round Self-Refine to produce structured action annotations; VL-JEPA is then trained on the dataset.","The pipeline yields O(100 million) temporally localized segments, and training VL-JEPA on Action100M produces consistent data-scaling gains and strong zero-shot action-recognition performance across benchmarks.","The abstract does not report annotation error rates, dataset biases, or a detailed breakdown of where automated labeling is strongest or weakest.","Use Action100M for larger-scale pretraining and world-model research, improve automated annotation quality, and study scaling behavior across more video tasks.",abstract-level synthesis
2601.06212,Akasha 2: Hamiltonian State Space Duality and Visual-Language Joint Embedding Predictive Architectur,arxiv,2026-01-08T18:40:31Z,Yani Meziani,cs.CV; cs.AI,https://huggingface.co/papers/2601.06212,https://arxiv.org/abs/2601.06212,/root/workspace/jepa/pdfs/2601.06212.pdf,Combining Hamiltonian State Space Duality with VL-JEPA and physics-inspired inductive biases can yield a multimodal latent world model with stronger spatiotemporal coherence and efficiency.,"Akasha 2 combines a Mamba-3 selective state space model, a Sparse Mixture of Hamiltonian Experts with symplectic integration, Hamiltonian Flow Matching, persistent 3D Gaussian Splatting, and a holographic memory architecture for multimodal modeling and visual synthesis.","The abstract reports state-of-the-art video prediction, sub-50 ms mobile latency, 4x faster visual synthesis than diffusion models, 3-18x inference speedups over transformer baselines, and maintained energy conservation over long horizons.","The metadata gives broad headline claims but not the detailed evaluation settings, ablations, or boundaries of the reported gains.","Stress-test the physics-inspired design across more multimodal tasks, reproduce the efficiency claims in broader settings, and isolate which inductive biases contribute most.",abstract-level synthesis
2601.03665,PhysVideoGenerator: Towards Physically Aware Video Generation via Latent Physics Guidance,huggingface_papers;arxiv,2026-01-07T07:38:58Z,Siddarth Nilol Kundur Satish; Devesh Jaiswal; Hongyu Chen; Abhishek Bakshi,cs.CV,https://huggingface.co/papers/2601.03665,https://arxiv.org/abs/2601.03665,/root/workspace/jepa/pdfs/2601.03665.pdf,Injecting V-JEPA 2-derived physics guidance into video diffusion can make physics-aware generation technically feasible.,"The framework trains a lightweight predictor network to regress physical features from noisy diffusion latents, then injects those predicted physics tokens into the temporal attention layers of a DiT-based generator through cross-attention while validating joint-training stability.","The abstract shows that diffusion latents retain enough information to recover V-JEPA 2 physical representations and that the joint optimization remains stable, establishing a basis for future physics-aware generative modeling.",This is presented as a proof of concept focused on architectural feasibility and training stability rather than large-scale gains in perceptual quality or physical realism.,"Run broader evaluations of physical realism, scale the approach to larger generators and datasets, and test stronger physics-guidance mechanisms.",abstract-level synthesis
2512.24497,What Drives Success in Physical Planning with Joint-Embedding Predictive World Models?,huggingface_papers;arxiv,2025-12-30T22:50:03Z,Basile Terver; Tsung-Yen Yang; Jean Ponce; Adrien Bardes; Yann LeCun,cs.AI; cs.LG; cs.RO; stat.ML,https://huggingface.co/papers/2512.24497,https://arxiv.org/abs/2512.24497,/root/workspace/jepa/pdfs/2512.24497.pdf,"Success in representation-space physical planning with JEPA world models depends on specific technical choices in architecture, training objective, and planning algorithm.","The paper defines this family as JEPA-WMs, performs a comparative study of key design components on simulated environments and real robotic data, and combines the strongest choices into a new model.",The resulting model outperforms DINO-WM and V-JEPA-2-AC on both navigation and manipulation tasks.,The abstract does not detail the full quantitative effect of each design choice or whether the conclusions transfer beyond the studied tasks and datasets.,"Extend JEPA-WM analysis to broader robotic settings, probe interactions among planning and representation choices, and test generalization to more unseen tasks and environments.",abstract-level synthesis
2512.21881,SLIM-Brain: A Data- and Training-Efficient Foundation Model for fMRI Data Analysis,huggingface_papers;arxiv,2025-12-26T06:10:31Z,Mo Wang; Junfeng Xia; Wenhao Ye; Enyu Liu; Kaining Peng; Jianfeng Feng; Quanying Liu; Hongkai Wen,cs.CV; q-bio.NC,https://huggingface.co/papers/2512.21881,https://arxiv.org/abs/2512.21881,/root/workspace/jepa/pdfs/2512.21881.pdf,An atlas-free JEPA-style design can improve both data efficiency and training efficiency for voxel-level fMRI foundation modeling without sacrificing fine-grained spatial detail.,SLIM-Brain uses a two-stage pipeline in which a lightweight temporal extractor ranks windows by saliency and a 4D Hiera-JEPA encoder learns voxel-level representations from the top-k windows while deleting about 70% of masked patches.,"Across seven public benchmarks, the model achieves new state-of-the-art results while needing only 4 thousand pre-training sessions and roughly 30% of the GPU memory of traditional voxel-level methods.","The abstract emphasizes benchmark performance and efficiency, but does not spell out cross-site robustness, clinical deployment constraints, or weaker task settings.","Scale the approach to more neuroimaging cohorts and tasks, refine saliency selection, and test robustness across acquisition settings and populations.",abstract-level synthesis
2512.19605,KerJEPA: Kernel Discrepancies for Euclidean Self-Supervised Learning,arxiv,2025-12-22T17:41:26Z,Eric Zimmermann; Harley Wiltzer; Justin Szeto; David Alvarez-Melis; Lester Mackey,cs.LG; cs.CV,https://huggingface.co/papers/2512.19605,https://arxiv.org/abs/2512.19605,/root/workspace/jepa/pdfs/2512.19605.pdf,Kernel-based regularizers broaden JEPA-style Euclidean self-supervised learning and can improve stability while offering more design flexibility than a single Gaussian-prior regularizer.,"The paper defines a family of KerJEPAs, connects one case to the LeJEPA Epps-Pulley regularizer, expands the set of admissible kernels and priors, and derives the closed-form high-dimensional limit of sliced MMDs.",The resulting KerJEPA variants are described as having improved training stability and greater flexibility in regularizer design.,The abstract does not include benchmark-by-benchmark downstream results or specify which kernels and priors are best in different practical settings.,"Evaluate kernel and prior choices across more tasks, adapt the framework to additional JEPA variants, and study how the theoretical results translate into downstream gains.",abstract-level synthesis
2512.15885,Seeing Beyond Words: Self-Supervised Visual Learning for Multimodal Large Language Models,huggingface_papers;arxiv,2025-12-17T19:01:34Z,Davide Caffagni; Sara Sarto; Marcella Cornia; Lorenzo Baraldi; Pier Luigi Dovesi; Shaghayegh Roohi; Mark Granroth-Wilding; Rita Cucchiara,cs.CV; cs.AI; cs.CL; cs.MM,https://huggingface.co/papers/2512.15885,https://arxiv.org/abs/2512.15885,/root/workspace/jepa/pdfs/2512.15885.pdf,MLLMs can gain stronger visual understanding by adding JEPA-inspired self-supervised visual learning instead of relying primarily on text supervision.,"The proposed JARVIS framework integrates the I-JEPA learning paradigm into vision-language alignment, uses frozen vision foundation models as context and target encoders, and trains the predictor via early LLM layers.","Across different LLM families, JARVIS consistently improves vision-centric benchmark performance without hurting multimodal reasoning ability.","The abstract does not describe compute trade-offs, where the gains are smallest, or how much the method depends on the chosen frozen vision encoders.","Apply JEPA-style visual enhancement to broader MLLM settings, study scaling and efficiency, and probe how it changes visual reasoning behavior.",abstract-level synthesis
2512.13684,Recurrent Video Masked Autoencoders,huggingface_papers;arxiv,2025-12-15T18:59:48Z,Daniel Zoran; Nikhil Parthasarathy; Yi Yang; Drew A Hudson; Joao Carreira; Andrew Zisserman,cs.CV,https://huggingface.co/papers/2512.13684,https://arxiv.org/abs/2512.13684,/root/workspace/jepa/pdfs/2512.13684.pdf,Recurrent computation can make video masked autoencoders more efficient while preserving strong general-purpose video representations.,RVM combines an asymmetric masking objective with a transformer-based recurrent neural network and trains only with a pixel reconstruction loss to aggregate temporal information efficiently.,"The model is competitive with VideoMAE and V-JEPA on video-level tasks, matches or exceeds strong image models on geometry-heavy tasks, achieves up to 30x better parameter efficiency in the small-model regime, and supports stable long-horizon feature propagation with linear cost.",The abstract does not present full trade-offs against all baselines or identify settings where recurrent masking is weaker than attention-heavy alternatives.,"Scale recurrent video representation learning further, test more long-horizon tasks, and explore how recurrence interacts with other self-supervised objectives.",abstract-level synthesis
2512.06628,MIND-V: Hierarchical World Model for Long-Horizon Robotic Manipulation with RL-based Physical Alignment,huggingface_papers;arxiv,2025-12-07T02:28:06Z,Ruicheng Zhang; Mingyang Zhang; Jun Zhou; Zhangrui Guo; Zunnan Xu; Xiaofan Liu; Zhizhou Zhong; Puxin Yan; Haocheng Luo; Xiu Li,cs.RO; cs.CV,https://huggingface.co/papers/2512.06628,https://arxiv.org/abs/2512.06628,/root/workspace/jepa/pdfs/2512.06628.pdf,A hierarchical world model with explicit semantic reasoning and RL-based physical alignment can synthesize more plausible long-horizon robotic manipulation videos and support policy learning.,"MIND-V combines a Semantic Reasoning Hub, a Behavioral Semantic Bridge, a Motor Video Generator, staged visual future rollouts, and GRPO post-training with a Physical Foresight Coherence reward that uses V-JEPA2 as a physics referee.",The abstract reports state-of-the-art performance in long-horizon simulation and meaningful value for downstream policy learning while emphasizing physically plausible and logically coherent video synthesis.,"The evidence described in the abstract is mainly simulation-based, with no detailed real-world robotic deployment or component-level quantitative breakdown.","Test the framework on physical robots, expand autonomous embodied data synthesis, and study how world-model planning and physical alignment interact at larger scales.",abstract-level synthesis
2512.06232,Opinion: Learning Intuitive Physics May Require More than Visual Data,arxiv,2025-12-06T00:49:41Z,Ellen Su; Solim Legris; Todd M. Gureckis; Mengye Ren,cs.CV; cs.LG,https://huggingface.co/papers/2512.06232,https://arxiv.org/abs/2512.06232,/root/workspace/jepa/pdfs/2512.06232.pdf,Improving intuitive-physics learning may require more than changing visual data volume or distribution for current V-JEPA-style models.,"The authors pretrain a V-JEPA model on the developmentally realistic, egocentric SAYCam dataset and evaluate the resulting representations on the IntPhys2 benchmark.","Training on SAYCam, despite its developmental realism, does not produce significant gains on IntPhys2, suggesting that data distribution and volume alone are insufficient for current architectures.","The abstract is limited to one dataset framing and benchmark setting, and leaves open whether different architectures, objectives, or nonvisual signals would change the outcome.","Investigate multimodal learning, architectural changes, and alternative training objectives for intuitive physics beyond visual-only pretraining.",abstract-level synthesis
2511.23428,DisMo: Disentangled Motion Representations for Open-World Motion Transfer,arxiv,2025-11-28T18:25:54Z,Thomas Ressler-Antal; Frank Fundel; Malek Ben Alaya; Stefan Andreas Baumann; Felix Krause; Ming Gui; Björn Ommer,cs.CV,https://huggingface.co/papers/2511.23428,https://arxiv.org/abs/2511.23428,/root/workspace/jepa/pdfs/2511.23428.pdf,A motion representation disentangled from static content can enable open-world motion transfer and stronger motion understanding than content-entangled video models.,DisMo learns abstract motion representations directly from raw video through an image-space reconstruction objective and connects them to existing video generators via lightweight adapters.,"The method supports motion transfer across semantically unrelated entities, improves control without the usual fidelity-versus-prompt trade-off described in prior work, and outperforms V-JEPA on cited zero-shot action-classification benchmarks.","The abstract does not quantify computational costs, failure cases, or how performance varies across different generator backbones and transfer scenarios.","Integrate the representation into more video generators, expand motion-editing applications, and probe its value on broader downstream motion benchmarks.",abstract-level synthesis
2511.18640,Health system learning achieves generalist neuroimaging models,huggingface_papers;arxiv,2025-11-23T22:34:50Z,Akhil Kondepudi; Akshay Rao; Chenhui Zhao; Yiwei Lyu; Samir Harake; Soumyanil Banerjee; Rushikesh Joshi; Anna-Katharina Meissner; Renly Hou; Cheng Jiang; Asadur Chowdury; Ashok Srinivasan; Brian Athey; Vikas Gulani; Aditya Pandey; Honglak Lee; Todd Hollon,cs.CV; cs.AI; cs.LG,https://huggingface.co/papers/2511.18640,https://arxiv.org/abs/2511.18640,/root/workspace/jepa/pdfs/2511.18640.pdf,Training directly on large-scale private clinical neuroimaging data can produce generalist medical vision models that outperform frontier public-data models on neuroimaging tasks.,The work trains NeuroVFM on 5.24 million clinical MRI and CT volumes using a scalable volumetric joint-embedding predictive architecture and then pairs it with open-source language models through lightweight visual instruction tuning for report generation.,"NeuroVFM achieves state-of-the-art performance across multiple clinical tasks, shows emergent neuroanatomic understanding and interpretable grounding, improves radiology report generation, and reduces hallucinated findings and critical errors relative to frontier models.","The abstract does not discuss external validation across institutions, data-governance constraints, or operational deployment details beyond the reported task results.","Extend health system learning across more institutions and imaging modalities, deepen safety and governance studies, and adapt the framework to additional clinical workflows.",abstract-level synthesis
2511.16567,POMA-3D: The Point Map Way to 3D Scene Understanding,arxiv,2025-11-20T17:22:51Z,Ye Mao; Weixun Luo; Ranran Huang; Junpeng Jing; Krystian Mikolajczyk,cs.CV,https://huggingface.co/papers/2511.16567,https://arxiv.org/abs/2511.16567,/root/workspace/jepa/pdfs/2511.16567.pdf,"Point maps, combined with JEPA-style multi-view consistency, can provide a strong self-supervised foundation for 3D scene understanding using geometric inputs alone.","POMA-3D learns from point maps laid out on structured 2D grids, transfers 2D priors through view-to-scene alignment, enforces cross-view consistency with POMA-JEPA, and pretrains on the new ScenePoint dataset built from room-level RGB-D scenes and 2D image scenes.","The model serves as a strong specialist and generalist 3D backbone across tasks including 3D question answering, embodied navigation, scene retrieval, and embodied localization, all using only 3D coordinates.","The abstract does not detail trade-offs against RGB-based approaches, compute demands, or which task settings benefit most from point-map pretraining.","Scale point-map pretraining further, test more embodied and 3D reasoning tasks, and explore richer multimodal extensions built on the POMA-JEPA framework.",abstract-level synthesis
2511.16333,"Beyond Generative AI: World Models for Clinical Prediction, Counterfactuals, and Planning",arxiv,2025-11-20T13:11:45Z,Mohammad Areeb Qazi; Maryam Nadeem; Mohammad Yaqub,cs.LG,https://huggingface.co/papers/2511.16333,https://arxiv.org/abs/2511.16333,/root/workspace/jepa/pdfs/2511.16333.pdf,"Clinical AI needs predictive, temporally coherent, and causally grounded world models rather than relying only on large generative models for decision support.","Review paper surveying healthcare world-model work across medical imaging, EHR-based disease progression, and robotic surgery, while introducing a four-level capability rubric from temporal prediction to planning/control.","Most reviewed systems reach temporal or action-conditioned prediction (L1-L2), while counterfactual decision support (L3) is less common and planning/control (L4) is rare.","The review highlights under-specified action spaces and safety constraints, weak interventional validation, incomplete multimodal state construction, and limited trajectory-level uncertainty calibration.",The paper calls for prediction-first clinical world models that combine generative backbones with causal or mechanical foundations for safer decision support.,abstract-level synthesis
