paper_id,title,source,published,authors,categories,hf_papers_url,arxiv_url,local_pdf,principal_argument,methodology,main_findings,limitations_or_gaps,future_opportunities,notes
2510.00974,JEPA-T: Joint-Embedding Predictive Architecture with Text Fusion for Image Generation,huggingface_papers;arxiv,2025-10-01T14:51:10Z,Siheng Wan; Zhengtao Yao; Zhengdao Li; Junhao Dong; Yanshu Li; Yikai Li; Linshan Li; Haoyan Xu; Yijiang Li; Zhikang Dong; Huacan Wang; Jifeng Shen,cs.CV,https://huggingface.co/papers/2510.00974,https://arxiv.org/abs/2510.00974,/root/workspace/jepa/pdfs/2510.00974.pdf,Late fusion plus objective-level text alignment can make a joint-embedding predictive transformer effective for text-conditioned image generation while keeping the backbone general.,"Introduces JEPA-T, which encodes images and captions into discrete tokens, applies a joint-embedding predictive Transformer, adds cross-attention after the predictor for conditional denoising, injects raw text embeddings before the flow-matching loss, and uses iterative denoising at inference.","On ImageNet-1K, the abstract reports strong data efficiency, open-vocabulary generalization, and consistent gains over non-fusion and late-fusion baselines.",The abstract only names ImageNet-1K evaluations and does not describe broader text-to-image benchmarks or qualitative failure modes.,Extend JEPA-style multimodal token modeling to broader text-to-image generation settings and other conditional generative tasks.,abstract-level synthesis
2509.24317,Rethinking JEPA: Compute-Efficient Video SSL with Frozen Teachers,huggingface_papers;arxiv,2025-09-29T05:55:17Z,Xianhang Li; Chen Huang; Chun-Liang Li; Eran Malach; Josh Susskind; Vimal Thilak; Etai Littwin,cs.LG; cs.CV,https://huggingface.co/papers/2509.24317,https://arxiv.org/abs/2509.24317,/root/workspace/jepa/pdfs/2509.24317.pdf,EMA-updated teachers are not necessary for V-JEPA-style video self-supervision; a frozen teacher can provide a simpler and more compute-efficient alternative.,"Introduces SALT, a two-stage scheme that first trains a target encoder by pixel reconstruction under V-JEPA masking, then freezes it and trains a student to predict the teacher latents on masked regions, followed by frozen-backbone benchmarking and scaling analysis.","The abstract reports that SALT students outperform V-JEPA 2 encoders under frozen evaluation, achieve better accuracy-FLOPs tradeoffs, and remain strong even when the teacher is small or sub-optimal.",The evidence presented is framed around frozen-backbone evaluation and the two-stage setup; the abstract does not detail broader downstream or end-to-end finetuning behavior.,Use frozen-teacher latent prediction for scalable video SSL and rethink compute allocation toward stronger students rather than more expensive teachers.,abstract-level synthesis
2509.15470,Self-supervised learning of imaging and clinical signatures using a multimodal joint-embedding predictive architecture,arxiv,2025-09-18T22:35:44Z,Thomas Z. Li; Aravind R. Krishnan; Lianrui Zuo; John M. Still; Kim L. Sandler; Fabien Maldonado; Thomas A. Lasko; Bennett A. Landman,cs.CV; cs.AI,https://huggingface.co/papers/2509.15470,https://arxiv.org/abs/2509.15470,/root/workspace/jepa/pdfs/2509.15470.pdf,"Multimodal JEPA pretraining on unlabeled longitudinal CT and EHR data can improve pulmonary nodule diagnosis, but its benefits may not transfer cleanly out of distribution.","Curates an unlabeled multimodal patient archive for JEPA pretraining, then performs supervised finetuning and compares against unregularized multimodal and imaging-only models on internal and external cohorts, alongside a synthetic environment for analyzing failure cases.","The abstract reports improved internal-cohort AUC over both comparison models, but worse external-cohort AUC than the imaging-only model, highlighting both gains and generalization limits.","A key limitation is explicit in the abstract: the method underperforms on the external cohort, and the study is focused on one medical application and institution-specific unlabeled archive.",Study when multimodal JEPA pretraining helps or hurts medical prediction and improve robustness to external distribution shifts.,abstract-level synthesis
2509.12249,Why and How Auxiliary Tasks Improve JEPA Representations,arxiv,2025-09-12T05:28:29Z,Jiacan Yu; Siyi Chen; Mingrui Liu; Nono Horiuchi; Vladimir Braverman; Zicheng Xu; Dan Haramati; Randall Balestriero,cs.LG; cs.AI,https://huggingface.co/papers/2509.12249,https://arxiv.org/abs/2509.12249,/root/workspace/jepa/pdfs/2509.12249.pdf,Auxiliary tasks improve JEPA representations because they anchor the distinctions that latent dynamics alone might otherwise collapse.,"Provides a theoretical analysis of a JEPA variant with a jointly trained auxiliary regression head, proves a no-unhealthy-collapse result in deterministic MDPs, and runs controlled ablations in a counting environment.","The abstract claims that driving both transition-consistency and auxiliary losses to zero forces non-equivalent observations to remain distinct in latent space, and that joint training with the auxiliary head yields richer representations than separate training.","The formal result is stated for deterministic MDPs and the experiments described are in a counting environment, so broader stochastic settings are not established in the abstract.",Design auxiliary objectives that encode the right equivalence relations for stronger JEPA encoders in model-based learning.,abstract-level synthesis
2509.14252,LLM-JEPA: Large Language Models Meet Joint Embedding Predictive Architectures,huggingface_papers;arxiv,2025-09-11T03:03:57Z,Hai Huang; Yann LeCun; Randall Balestriero,cs.CL; cs.AI,https://huggingface.co/papers/2509.14252,https://arxiv.org/abs/2509.14252,/root/workspace/jepa/pdfs/2509.14252.pdf,JEPA-style embedding-space objectives can improve LLM pretraining and finetuning over standard reconstruction-oriented language training objectives.,"Introduces LLM-JEPA, a JEPA-based training approach for language models, and evaluates it across multiple datasets and model families in both pretraining and finetuning settings.","The abstract reports significant gains over standard LLM objectives on NL-RX, GSM8K, Spider, and RottenTomatoes, with robustness to overfitting across Llama3, OpenELM, Gemma2, and Olmo models.","The abstract does not specify detailed architectural trade-offs, compute cost, or settings where the JEPA objective may underperform.","The work opens a path for broader JEPA-style training research for language models across additional tasks, scales, and training regimes.",abstract-level synthesis
2508.10489,Learning State-Space Models of Dynamic Systems from Arbitrary Data using Joint Embedding Predictive Architectures,arxiv,2025-08-14T09:46:11Z,Jonas Ulmen; Ganesh Sundaram; Daniel Görges,cs.LG,https://huggingface.co/papers/2508.10489,https://arxiv.org/abs/2508.10489,/root/workspace/jepa/pdfs/2508.10489.pdf,JEPA-style representation learning combined with continuous-time dynamics can recover structured latent state-space models from arbitrary observations.,Combines sequence embeddings with neural ODEs and uses losses enforcing contractive embeddings and Lipschitz-constrained state transitions; demonstrates the approach on a simple pendulum from image observations.,"The method is reported to generate structured latent state-space models for a pendulum using only image data, showing promise for world modeling from arbitrary observations.","Evidence in the abstract is limited to a simple pendulum example, with no detail on more complex systems, robustness, or downstream control performance.",The abstract points to more general control and estimation methods in robotics built on these learned latent dynamics.,abstract-level synthesis
2507.15216,Improving Joint Embedding Predictive Architecture with Diffusion Noise,huggingface_papers;arxiv,2025-07-21T03:36:58Z,Yuping Qiu; Rui Zhu; Ying-cong Chen,cs.CV,https://huggingface.co/papers/2507.15216,https://arxiv.org/abs/2507.15216,/root/workspace/jepa/pdfs/2507.15216.pdf,Injecting diffusion noise into JEPA-style masked image modeling can strengthen self-supervised visual representation learning.,"Proposes N-JEPA, which incorporates diffusion noise through masked-token position embeddings and adds a multi-level noise schedule as a feature-augmentation strategy.",A comprehensive downstream classification study is said to confirm the effectiveness of the method and the robustness benefits of the noise schedule.,"The abstract focuses on recognition performance and does not report detailed benchmark outcomes, generative behavior, or failure modes.","The work suggests deeper exploration of the connection between diffusion-style corruption and self-supervised recognition models, alongside public code release.",abstract-level synthesis
2507.03633,From Video to EEG: Adapting Joint Embedding Predictive Architecture to Uncover Saptiotemporal Dynamics in Brain Signal Analysis,huggingface_papers;arxiv,2025-07-04T15:01:34Z,Amirabbas Hojjati; Lu Li; Ibrahim Hameed; Anis Yazidi; Pedro G. Lind; Rabindra Khadka,cs.CV; cs.AI; cs.LG,https://huggingface.co/papers/2507.03633,https://arxiv.org/abs/2507.03633,/root/workspace/jepa/pdfs/2507.03633.pdf,Treating EEG as video-like sequences allows V-JEPA to learn scalable and interpretable spatiotemporal EEG representations for classification.,"Adapts V-JEPA to EEG classification with joint embeddings and adaptive masking, and evaluates the model on the TUH Abnormal EEG dataset while examining learned signal patterns.",EEG-VJEPA reportedly outperforms existing state-of-the-art EEG classifiers and captures physiologically relevant spatial and temporal patterns that support interpretability.,"The abstract highlights results on one public dataset and does not describe performance across broader EEG tasks, sites, or deployment conditions.","The paper positions EEG-VJEPA as a candidate framework for scalable, trustworthy EEG analysis and human-AI support in diagnostic workflows.",abstract-level synthesis
2507.01080,"Development and Comparative Evaluation of Three Artificial Intelligence Models (NLP, LLM, JEPA) for Predicting Triage in Emergency Departments: A 7-Month Retrospective Proof-of-Concept",arxiv,2025-07-01T16:37:55Z,Edouard Lansiaux; Ramy Azzouz; Emmanuel Chazard; Amélie Vromant; Eric Wiel,cs.LG; cs.PF,https://huggingface.co/papers/2507.01080,https://arxiv.org/abs/2507.01080,/root/workspace/jepa/pdfs/2507.01080.pdf,A comparative triage study suggests LLM-based modeling is more effective than the tested NLP and JEPA alternatives for emergency-department triage prediction.,"Evaluates three AI systems against the FRENCH triage scale and nurse practice using seven months of adult triage data from Roger Salengro Hospital in Lille, France.","The LLM-based URGENTIAPARSE achieved the best reported accuracy, AUC-ROC, and hospitalization-prediction performance, outperforming both the NLP and JEPA models as well as nurse triage.","This is a seven-month retrospective proof-of-concept at a single hospital, and the abstract notes that adoption still depends on addressing limitations and ethical transparency.",The summary points toward ethically transparent integration of LLM-based support tools into emergency-department workflows.,abstract-level synthesis
2507.02915,Audio-JEPA: Joint-Embedding Predictive Architecture for Audio Representation Learning,huggingface_papers;arxiv,2025-06-25T08:38:27Z,Ludovic Tuncay; Etienne Labbé; Emmanouil Benetos; Thomas Pellegrini,cs.SD; cs.AI; cs.LG; eess.AS; eess.SP,https://huggingface.co/papers/2507.02915,https://arxiv.org/abs/2507.02915,/root/workspace/jepa/pdfs/2507.02915.pdf,A straightforward JEPA adaptation to audio can learn competitive audio representations without reconstructing raw waveforms.,"Uses a Vision Transformer to predict masked mel-spectrogram patch representations, pretrains on unlabeled AudioSet clips, and evaluates on the X-ARES speech, music, and environmental sound suite.","Despite being a simple translation of the original model and using no hyper-parameter tuning, Audio-JEPA is reported to perform comparably to wav2vec 2.0 and data2vec with less than one-fifth of their training data.","The abstract presents an intentionally simple adaptation and does not detail scaling behavior, domain-specific weaknesses, or stronger audio-specialized variants.","Release code and checkpoints and build more audio-specific JEPA variants for speech, music, and environmental sound tasks.",abstract-level synthesis
2506.18194,Joint Embedding Predictive Architecture for self-supervised pretraining on polymer molecular graphs,arxiv,2025-06-22T22:51:53Z,Francesco Piccoli; Gabriel Vogel; Jana M. Weber,cs.LG,https://huggingface.co/papers/2506.18194,https://arxiv.org/abs/2506.18194,/root/workspace/jepa/pdfs/2506.18194.pdf,JEPA-based self-supervised pretraining can improve polymer graph learning when high-quality labels are scarce.,Applies JEPA self-supervised pretraining to polymer molecular graphs and compares downstream property-prediction performance across multiple datasets under limited-label conditions.,"The abstract reports downstream improvements across all tested datasets, with especially strong benefits when labeled data is very scarce.","The summary does not describe architecture choices, pretraining cost, or whether the gains persist when more labeled data is available.",The work supports further use of JEPA-style graph pretraining for polymer discovery and other low-label materials-learning settings.,abstract-level synthesis
2507.00028,HiT-JEPA: A Hierarchical Self-supervised Trajectory Embedding Framework for Similarity Computation,arxiv,2025-06-17T11:46:03Z,Lihuan Li; Hao Xue; Shuang Ao; Yang Song; Flora Salim,cs.LG; cs.AI; cs.CV,https://huggingface.co/papers/2507.00028,https://arxiv.org/abs/2507.00028,/root/workspace/jepa/pdfs/2507.00028.pdf,Hierarchical JEPA representations can jointly capture fine-grained and high-level trajectory semantics for better similarity computation.,"Introduces a three-layer hierarchy that learns point-level, intermediate, and high-level urban trajectory representations within one joint-embedding predictive framework.",Experiments on multiple real-world datasets are reported to yield richer multi-scale representations and improved trajectory similarity computation.,The abstract is centered on similarity tasks and does not discuss other trajectory analytics uses or the computational trade-offs of the hierarchical design.,The framework could be extended to broader urban trajectory analysis settings that benefit from multi-scale movement representations.,abstract-level synthesis
2506.09985,"V-JEPA 2: Self-Supervised Video Models Enable Understanding, Prediction and Planning",huggingface_papers;arxiv,2025-06-11T17:57:09Z,Mido Assran; Adrien Bardes; David Fan; Quentin Garrido; Russell Howes; Mojtaba; Komeili; Matthew Muckley; Ammar Rizvi; Claire Roberts; Koustuv Sinha; Artem Zholus; Sergio Arnaud; Abha Gejji; Ada Martin; Francois Robert Hogan; Daniel Dugas; Piotr Bojanowski; Vasil Khalidov; Patrick Labatut; Francisco Massa; Marc Szafraniec; Kapil Krishnakumar; Yong Li; Xiaodong Ma; Sarath Chandar; Franziska Meier; Yann LeCun; Michael Rabbat; Nicolas Ballas,cs.AI; cs.CV; cs.LG; cs.RO,https://huggingface.co/papers/2506.09985,https://arxiv.org/abs/2506.09985,/root/workspace/jepa/pdfs/2506.09985.pdf,"Large-scale self-supervised video JEPA models can support world understanding, anticipation, question answering, and robotic planning from mostly observational data.","Pretrains V-JEPA 2 on over 1 million hours of internet video and images, aligns it with a large language model for video question answering, and post-trains an action-conditioned variant with limited robot data for planning.","The abstract reports strong motion-understanding results, state-of-the-art human action anticipation and several video-QA scores, plus zero-shot pick-and-place planning on Franka arms in two labs.","The abstract does not detail compute demands, failure modes, or broader robotics generalization, and the planning setup still relies on post-training with robot data.",The work opens opportunities for self-supervised world models that connect web-scale video learning to physical-world planning and control.,abstract-level synthesis
2505.03176,seq-JEPA: Autoregressive Predictive Learning of Invariant-Equivariant World Models,huggingface_papers;arxiv,2025-05-06T04:39:11Z,Hafez Ghaemi; Eilif Muller; Shahab Bakhtiari,cs.CV; cs.AI; cs.LG,https://huggingface.co/papers/2505.03176,https://arxiv.org/abs/2505.03176,/root/workspace/jepa/pdfs/2505.03176.pdf,Sequential JEPA world modeling can learn invariant and equivariant representations together without the usual trade-off between them.,"Processes short sequences of transformed views, combines each with a relative transformation embedding, aggregates them with a transformer, and predicts the next representation conditioned on the upcoming action.",seq-JEPA is reported to perform strongly on both invariance- and equivariance-oriented tasks and to excel on sequence-based problems such as path integration and predictive learning across eye movements.,"The abstract does not quantify compute or data trade-offs, and the evidence described is limited to the reported downstream tasks.","The approach suggests richer sequential world models for predictive learning, navigation-like problems, and other action-conditioned perception tasks.",abstract-level synthesis
2504.16591,JEPA for RL: Investigating Joint-Embedding Predictive Architectures for Reinforcement Learning,arxiv,2025-04-23T10:16:12Z,Tristan Kenneweg; Philip Kenneweg; Barbara Hammer,cs.CV,https://huggingface.co/papers/2504.16591,https://arxiv.org/abs/2504.16591,/root/workspace/jepa/pdfs/2504.16591.pdf,JEPA can be adapted from self-supervised vision to reinforcement learning from images if model collapse is understood and mitigated.,"Adapts JEPA to image-based reinforcement learning, studies model collapse and prevention strategies, and provides an initial demonstration on the Cart Pole task.",The paper offers early evidence on classical Cart Pole and emphasizes practical handling of collapse in this RL setting.,"The abstract mentions only exemplary results on Cart Pole, so performance on harder RL environments and broader benchmarks is left unclear.",A natural next step is evaluating JEPA-based RL on more complex image-based control tasks beyond the initial Cart Pole study.,abstract-level synthesis
2504.16140,SparseJEPA: Sparse Representation Learning of Joint Embedding Predictive Architectures,huggingface_papers;arxiv,2025-04-22T02:43:00Z,Max Hartman; Lav Varshney,cs.LG; cs.AI,https://huggingface.co/papers/2504.16140,https://arxiv.org/abs/2504.16140,/root/workspace/jepa/pdfs/2504.16140.pdf,Adding sparsity to JEPA can produce more interpretable and semantically organized representations while retaining predictive quality.,"Introduces SparseJEPA with a sparsity-inducing penalty, trains a lightweight Vision Transformer on CIFAR-100, evaluates transfer with linear probes on classification and low-level tasks, and provides a theoretical argument based on reduced multiinformation.","The abstract reports improved and more meaningful embeddings, transfer gains across task types, and theoretical support for the grouping mechanism.","The reported evidence is centered on CIFAR-100 and a lightweight model, leaving larger-scale behavior and broader dataset coverage unspecified.",The abstract explicitly suggests extending the grouping mechanism toward new sparse and object-centric representation-learning methods.,abstract-level synthesis
2504.10512,JEPA4Rec: Learning Effective Language Representations for Sequential Recommendation via Joint Embedding Predictive Architecture,arxiv,2025-04-10T01:31:11Z,Minh-Anh Nguyen; Dung D. Le,cs.IR; cs.AI; cs.CL,https://huggingface.co/papers/2504.10512,https://arxiv.org/abs/2504.10512,/root/workspace/jepa/pdfs/2504.10512.pdf,"JEPA-enhanced language representation learning can improve sequential recommendation, especially when data is sparse or transfer is required.","Represents items as text sentences, encodes them with a modified bidirectional transformer, predicts masked-sentence representations, and uses a two-stage self-supervised training strategy.","Across six real-world datasets, JEPA4Rec reportedly outperforms prior methods, with especially strong results in cross-domain, cross-platform, and low-resource scenarios.",The abstract does not specify difficult recommendation cases that remain unsolved or the training cost of the two-stage pipeline.,The work supports more transferable recommendation systems built from JEPA-style text representations with reduced dependence on massive pretraining corpora.,abstract-level synthesis
2504.03169,REJEPA: A Novel Joint-Embedding Predictive Architecture for Efficient Remote Sensing Image Retrieval,arxiv,2025-04-04T04:59:10Z,Shabnam Choudhury; Yash Salunkhe; Sarthak Mehrotra; Biplab Banerjee,cs.CV,https://huggingface.co/papers/2504.03169,https://arxiv.org/abs/2504.03169,/root/workspace/jepa/pdfs/2504.03169.pdf,Feature-space prediction with JEPA can make remote sensing image retrieval both more accurate and more computationally efficient.,"Introduces REJEPA for unimodal remote-sensing retrieval using spatially distributed context tokens to predict target representations, with VICReg regularization to avoid collapse and promote diverse features.","The abstract reports 40-60% lower computational complexity than pixel-reconstruction baselines and sizable retrieval gains across BEN-14K and FMoW benchmarks, with sensor-agnostic generalization.","The summary emphasizes benchmark gains but does not detail weak cases, modality-shift failure modes, or deployment trade-offs beyond the reported efficiency.",The method is positioned as a scalable sensor-agnostic foundation for larger and more diverse remote-sensing retrieval systems.,abstract-level synthesis
2503.06380,TI-JEPA: An Innovative Energy-based Joint Embedding Strategy for Text-Image Multimodal Systems,huggingface_papers;arxiv,2025-03-09T01:34:28Z,Khang H. N. Vo; Duc P. T. Nguyen; Thong Nguyen; Tho T. Quan,cs.CV; cs.CL,https://huggingface.co/papers/2503.06380,https://arxiv.org/abs/2503.06380,/root/workspace/jepa/pdfs/2503.06380.pdf,An energy-based JEPA pretraining strategy can reduce the semantic gap between text and image modalities in multimodal systems.,"Introduces TI-JEPA, which uses an energy-based model framework for self-supervised text-image alignment and evaluates the approach on multiple multimodal benchmarks.",The abstract reports state-of-the-art performance on multimodal sentiment analysis and suggests promise for additional tasks such as visual question answering.,"The abstract focuses on benchmark performance and does not spell out architectural details, data scale, or settings where the approach may struggle.",The work suggests extending energy-based JEPA pretraining to a wider range of multimodal downstream tasks beyond sentiment analysis.,abstract-level synthesis
2502.03933,HEP-JEPA: A foundation model for collider physics using joint embedding predictive architecture,huggingface_papers;arxiv,2025-02-06T10:16:27Z,Jai Bardhan; Radhikesh Agrawal; Abhiram Tilak; Cyrin Neeraj; Subhadip Mitra,cs.LG; hep-ex; hep-ph,https://huggingface.co/papers/2502.03933,https://arxiv.org/abs/2502.03933,/root/workspace/jepa/pdfs/2502.03933.pdf,A transformer-based JEPA can act as a foundation model for collider physics by learning jet representations from unlabeled constituent information and transferring well to downstream jet tasks.,"Pre-trains on the 100M-jet JetClass dataset with a self-supervised JEPA-style objective that uses a subset of jet constituents as context and predicts embeddings of unseen target constituents, then evaluates on jet classification, top tagging, and quark-versus-gluon discrimination.",The pre-trained model performs well on standard jet classification benchmarks across datasets and is evaluated competitively on top tagging and light-quark-versus-gluon discrimination against baselines and state-of-the-art high-energy-physics models.,"The abstract emphasizes jet-related benchmarks and does not detail broader collider applications, error modes, or limitations beyond the evaluated downstream tasks.",Extend JEPA-style pretraining to a wider range of collider-physics tasks and study how a single pre-trained model transfers across more experimental settings.,abstract-level synthesis
2501.14622,ACT-JEPA: Novel Joint-Embedding Predictive Architecture for Efficient Policy Representation Learning,huggingface_papers;arxiv,2025-01-24T16:41:41Z,Aleksandar Vujinovic; Aleksandar Kovacevic,cs.LG; cs.AI,https://huggingface.co/papers/2501.14622,https://arxiv.org/abs/2501.14622,/root/workspace/jepa/pdfs/2501.14622.pdf,ACT-JEPA argues that combining imitation learning with JEPA-style self-supervision can produce more efficient policy representations and stronger world models than imitation learning alone.,"Trains an end-to-end architecture that jointly predicts action sequences and latent observation sequences, using JEPA to learn in latent space across multiple environments and tasks.","The method outperforms the strongest baseline in every tested environment, with up to 40% better world-model understanding and up to 10% higher task success rate; predicting latent observations also generalizes to predicting actions.",The abstract does not specify the tested environments in detail and remains focused on the imitation-learning setting rather than broader decision-making regimes.,Test the approach in more diverse control settings and further explore how latent-sequence prediction can reduce reliance on costly expert demonstrations.,abstract-level synthesis
